Link,Author,Release Date,Title
https://forum.apecoin.com/t/about-the-administrative-review-category/10468,https://forum.apecoin.com/u/river,2023-01-01,About the Administrative Review category
https://forum.apecoin.com/t/aip-419-expansion-of-apechain-presence-in-key-asian-events/23113,https://forum.apecoin.com/u/misterhype,2024-04-17,AIP-419: Expansion of ApeChain Presence in Key Asian Events
https://forum.apecoin.com/t/aip-412-streamlining-working-group-elections-improved-second-round-voting-strategy/21502,https://forum.apecoin.com/u/allcitybayc,2024-04-16,AIP-412: Streamlining Working Group Elections: Improved Second-Round Voting Strategy
https://forum.apecoin.com/t/aip-396-lfg-ventures-presents-made-by-apes-powered-by-apecoin/21428,https://forum.apecoin.com/u/captainzwingli,2024-04-16,AIP-396: LFG VENTURES presents: Made by Apes - Powered by ApeCoin
https://forum.apecoin.com/t/aip-417-ip-ecosystem-with-clip-powered-by-apecoin/22886,https://forum.apecoin.com/u/jasonjape,2024-04-15,AIP-417: IP Ecosystem with CLIP Powered by ApeCoin
https://forum.apecoin.com/t/aip-413-elect-a-chairman-inside-special-council/21580,https://forum.apecoin.com/u/buuvei,2024-04-02,AIP-413: Elect a Chairman inside Special Council
https://forum.apecoin.com/t/aip-391-apedomain-the-omni-chain-name-service-for-apecoin/21344,https://forum.apecoin.com/u/ervin,2024-03-04,AIP-391: ApeDomain - the omni-chain name service for ApeCoin
https://forum.apecoin.com/t/aip-389-innovative-treasury-strategy-generating-revenue-through-covered-call-lending/21198,https://forum.apecoin.com/u/dominic,2024-02-13,AIP-389: Innovative Treasury Strategy: Generating Revenue through Covered Call Lending
https://forum.apecoin.com/t/aip-371-the-apeblendr-no-loss-savings-game-built-on-top-of-apecoin-and-apecoin-staking/19833,https://forum.apecoin.com/u/0xfusion,2024-01-10,AIP-371: The ApeBlendr - No-loss savings game built on top of ApeCoin and ApeCoin Staking
