Link,Author,Release Date,Title
https://forum.apecoin.com/t/about-the-aip-ideas-category/6300,https://forum.apecoin.com/u/river,2024-03-03,About the AIP Ideas category
https://forum.apecoin.com/t/a-survey-on-token-holder-motivations-and-expectations/22845,https://forum.apecoin.com/u/daotimes,2024-03-31,A Survey on Token Holder Motivations and Expectations
https://forum.apecoin.com/t/reviving-the-nft-market-a-plan-for-apes-kodas-meebits-more-moving-forward/22844,https://forum.apecoin.com/u/allcitybayc,2024-03-31,"Reviving the NFT Market: A Plan for Apes, Kodas, Meebits & More Moving Forward"
https://forum.apecoin.com/t/ip-ecosystem-with-clip-powered-by-apecoin/22886,https://forum.apecoin.com/u/jasonjape,2024-03-29,IP Ecosystem with CLIP Powered by ApeCoin
https://forum.apecoin.com/t/single-seat-nominees-a-more-competitive-election-pool/22907,https://forum.apecoin.com/u/cryptologically,2024-03-28,Single Seat Nominees - A More Competitive Election Pool
https://forum.apecoin.com/t/proposal-to-integrate-augmented-reality-with-the-apecoin-ecosystem/22891,https://forum.apecoin.com/u/mutant33,2024-03-28,Proposal to integrate Augmented Reality with the ApeCoin ecosystem
https://forum.apecoin.com/t/apes-get-twisted/22804,https://forum.apecoin.com/u/fuego,2024-03-27,Apes Get Twisted
https://forum.apecoin.com/t/beyond-the-bored-ape-the-story-breakdown/22792,https://forum.apecoin.com/u/jeann,2024-03-27,Beyond the Bored Ape: The Story Breakdown
https://forum.apecoin.com/t/wild-idea-1-introducing-apecoinlive-a-weekly-raffle/22790,https://forum.apecoin.com/u/ssp1111,2024-03-27,Wild Idea #1: Introducing ApeCoinLive: A Weekly Raffle
https://forum.apecoin.com/t/memecoin-for-ape-holders-on-solana/22761,https://forum.apecoin.com/u/uzi,2024-03-23,Memecoin for $APE Holders on Solana
https://forum.apecoin.com/t/keeping-up-with-the-apes-never-miss-any-new-developments/22756,https://forum.apecoin.com/u/ceoofweb3.0,2024-03-23,Keeping up with the Apes : Never miss any new developments
https://forum.apecoin.com/t/quadratic-voting-system/22635,https://forum.apecoin.com/u/valll67,2024-03-18,Quadratic voting system
https://forum.apecoin.com/t/apecoin-dao-s-otherside-strategy-acquisition-of-assets-and-usage/21407,https://forum.apecoin.com/u/cypherglaze,2024-03-10,ApeCoin DAO’s Otherside Strategy - Acquisition of assets and usage
https://forum.apecoin.com/t/proposing-grant-ships-as-the-premier-grants-program-for-apechain/22209,https://forum.apecoin.com/u/boiler,2024-03-02,Proposing Grant Ships as the Premier Grants Program for ApeChain
https://forum.apecoin.com/t/apecoindao-defining-official-working-groups/21501,https://forum.apecoin.com/u/allcitybayc,2024-03-01,ApeCoinDAO: Defining Official Working Groups
