Link,Author,Release Date,Title
https://forum.apecoin.com/t/about-the-aip-drafts-category/6301,https://forum.apecoin.com/u/river,2022-05-01,About the AIP Drafts category
https://forum.apecoin.com/t/aip-416-maga-make-apes-great-again/22804,https://forum.apecoin.com/u/fuego,2024-04-05,AIP-416: MAGA - Make Apes Great Again
https://forum.apecoin.com/t/aip-415-single-seat-nominees-a-more-competitive-election-pool/22907,https://forum.apecoin.com/u/cryptologically,2024-04-05,AIP-415: Single Seat Nominees - A More Competitive Election Pool
https://forum.apecoin.com/t/aip-408-q2-q3-2024-governance-working-group-budget/21345,https://forum.apecoin.com/u/allcitybayc,2024-04-03,AIP-408: Q2/Q3 2024 Governance Working Group Budget
https://forum.apecoin.com/t/aip-410-apecoin-dao-goes-to-hollywood/22480,https://forum.apecoin.com/u/dany319,2024-03-31,AIP-410: ApeCoin DAO Goes to Hollywood
https://forum.apecoin.com/t/aip-401-guidelines-for-request-for-proposals-rfp/21510,https://forum.apecoin.com/u/livefast9986,2024-03-29,AIP-401: Guidelines for Request for Proposals (RFP)
https://forum.apecoin.com/t/aip-412-streamlining-working-group-elections-improved-second-round-voting-strategy/21502,https://forum.apecoin.com/u/allcitybayc,2024-03-27,AIP-412: Streamlining Working Group Elections: Improved Second-Round Voting Strategy
