Link,Author,Release Date,Title
https://forum.arbitrum.foundation/t/writing-your-first-proposal-to-the-arbitrumdao/21366,https://forum.arbitrum.foundation/u/arbitrum,2024-04-05,Writing Your First Proposal to the ArbitrumDAO
https://forum.arbitrum.foundation/t/support-to-establish-grantsdaos/19908,https://forum.arbitrum.foundation/u/arbitrum,2024-05-13,Support to Establish GrantsDAOs
https://forum.arbitrum.foundation/t/about-the-proposals-category/19,https://forum.arbitrum.foundation/u/system,2023-03-01,About the Proposals category
https://forum.arbitrum.foundation/t/rfc-arbitrum-multi-sig-support-service-mss/23737,https://forum.arbitrum.foundation/u/entropy,,[RFC] Arbitrum Multi-sig Support Service (MSS)
https://forum.arbitrum.foundation/t/adjusting-arbitrum-s-gas-fees/25002,https://forum.arbitrum.foundation/u/entropy,2024-06-27,Adjusting Arbitrum’s Gas Fees
https://forum.arbitrum.foundation/t/arb-staking-use-surplus-fees-to-align-governance/25084,https://forum.arbitrum.foundation/u/frisson,2024-06-27,ARB Staking: Use Surplus Fees to Align Governance
https://forum.arbitrum.foundation/t/improving-predictability-in-arbitrum-dao-s-operations/25136,https://forum.arbitrum.foundation/u/entropy,2024-06-27,Improving Predictability in Arbitrum DAO’s Operations
https://forum.arbitrum.foundation/t/non-constitutional-arbitrumhub-evolution-the-next-step-in-streamlining-information-access-and-raising-awareness-for-arbitrum-dao/24857,https://forum.arbitrum.foundation/u/0x_buidler,2024-06-27,[Non-Constitutional] ArbitrumHub Evolution: The Next Step in Streamlining Information Access and Raising Awareness for Arbitrum DAO
https://forum.arbitrum.foundation/t/pilot-phase-m-a-for-arbitrum-dao/23588,https://forum.arbitrum.foundation/u/bernard,2024-06-26,Pilot Phase: M&A for Arbitrum DAO
https://forum.arbitrum.foundation/t/temperature-check-change-arbitrum-expansion-program-to-allow-deployments-of-new-orbit-chains-on-any-blockchain/23280,https://forum.arbitrum.foundation/u/arbitrum,2024-06-25,Temperature Check: Change Arbitrum Expansion Program to allow deployments of new Orbit chains on any blockchain
https://forum.arbitrum.foundation/t/betting-on-builders-infinite-launchpad-proposal/24665,https://forum.arbitrum.foundation/u/aminiman,2024-06-25,Betting on Builders: Infinite Launchpad Proposal
https://forum.arbitrum.foundation/t/proposal-non-constitutional-rndao-proposal-for-an-arbitrum-collab-tech-business-cluster/21339,https://forum.arbitrum.foundation/u/danielo,2024-06-25,Proposal: [Non-Constitutional] RnDAO proposal for an Arbitrum Collab Tech Business Cluster
https://forum.arbitrum.foundation/t/kwenta-x-perennial-arbitrum-onboarding-incentives-updated/22736,https://forum.arbitrum.foundation/u/jacobpphillips,2024-06-25,Kwenta x Perennial: Arbitrum Onboarding Incentives (UPDATED)
https://forum.arbitrum.foundation/t/aip-funds-to-bootstrap-the-first-bold-validator/24506,https://forum.arbitrum.foundation/u/arbitrum,2024-06-24,AIP: Funds to bootstrap the first BoLD validator
https://forum.arbitrum.foundation/t/proposal-grant-request-for-koryntia-pioneering-the-next-generation-of-defi-lending/24693,https://forum.arbitrum.foundation/u/gregoriopunzano,2024-06-24,Proposal: Grant Request for Koryntia - Pioneering the Next Generation of DeFi Lending
https://forum.arbitrum.foundation/t/non-constitutional-pilot-stage-treasury-backed-vaults-research-and-development/24692,https://forum.arbitrum.foundation/u/cupojoseph,2024-06-24,[Non-Constitutional] Pilot Stage: Treasury Backed Vaults research and development
https://forum.arbitrum.foundation/t/aip-bold-permissionless-validation-for-arbitrum/23232,https://forum.arbitrum.foundation/u/arbitrum,2024-06-24,AIP: BOLD - permissionless validation for Arbitrum
https://forum.arbitrum.foundation/t/non-constitutional-pilot-phase-arbitrum-venture-initiative/24247,https://forum.arbitrum.foundation/u/lino,2024-06-24,[Non-Constitutional] Pilot Phase: Arbitrum Venture Initiative
https://forum.arbitrum.foundation/t/aip-whitelist-infura-nova-validator/25083,https://forum.arbitrum.foundation/u/infura,2024-06-21,AIP: Whitelist Infura Nova Validator
https://forum.arbitrum.foundation/t/tally-front-end-interface-to-force-transaction-inclusion-during-sequencer-downtime/21247,https://forum.arbitrum.foundation/u/gonzacolo,2024-06-20,Tally: Front-end interface to force transaction inclusion during sequencer downtime
https://forum.arbitrum.foundation/t/govhack-at-eth-cc-brussels/23305,https://forum.arbitrum.foundation/u/entropy,2024-06-19,GovHack at ETH CC (Brussels)
https://forum.arbitrum.foundation/t/request-for-additional-funding-for-the-arbitrum-dda-program/24862,https://forum.arbitrum.foundation/u/srijith-questbook,2024-06-19,Request for Additional Funding for the Arbitrum DDA Program
https://forum.arbitrum.foundation/t/proposal-recruiting-talent-solutions-for-the-dao/24964,https://forum.arbitrum.foundation/u/0xjulian,2024-06-18,Proposal: Recruiting & Talent Solutions for the DAO
https://forum.arbitrum.foundation/t/reverse-and-revise-the-gcp-for-increased-transparency-and-sustainability/24918,https://forum.arbitrum.foundation/u/longshortleftight,2024-06-18,Reverse and revise the GCP for increased transparency and sustainability
https://forum.arbitrum.foundation/t/catalyze-gaming-ecosystem-growth-on-arbitrum/22368,https://forum.arbitrum.foundation/u/djinn,2024-06-15,Catalyze Gaming Ecosystem Growth on Arbitrum
https://forum.arbitrum.foundation/t/proposal-non-constitutional-the-establishment-of-arbitrum-impact-a-501c3-funded-by-the-people-powered-blockchain-governed-by-the-arbitrum-dao/24945,https://forum.arbitrum.foundation/u/dannym,2024-06-14,"Proposal [Non-Constitutional]: The Establishment of ‘Arbitrum Impact’ a 501c3 Funded by the People Powered Blockchain, Governed by the Arbitrum DAO"
https://forum.arbitrum.foundation/t/arb-is-for-the-people/24799,https://forum.arbitrum.foundation/u/boopbane,2024-06-12,ARB is for the people
https://forum.arbitrum.foundation/t/expand-tally-support-for-the-arbitrum-dao/22387,https://forum.arbitrum.foundation/u/frisson,2024-06-11,Expand Tally Support for the Arbitrum DAO
https://forum.arbitrum.foundation/t/proposal-non-constitutional-defending-open-source-a-united-stand-for-developer-rights-and-software-freedom/23047,https://forum.arbitrum.foundation/u/immutablelawyer,2024-06-10,Proposal [Non-Constitutional]: Defending Open Source: A United Stand for Developer Rights and Software Freedom
https://forum.arbitrum.foundation/t/constitutional-aip-security-council-improvement-proposal/20541,https://forum.arbitrum.foundation/u/krst,2024-06-09,Constitutional AIP - Security Council Improvement Proposal
https://forum.arbitrum.foundation/t/aip-support-rip-7212-for-account-abstraction-wallets-arbos-30/23298,https://forum.arbitrum.foundation/u/arbitrum,2024-06-09,AIP: Support RIP-7212 for Account Abstraction Wallets (ArbOS 30)
https://forum.arbitrum.foundation/t/aip-activate-stylus-and-enable-next-gen-webassembly-smart-contracts-arbos-30/22970,https://forum.arbitrum.foundation/u/arbitrum,2024-06-09,AIP: Activate Stylus and Enable Next-Gen WebAssembly Smart Contracts (ArbOS 30)
https://forum.arbitrum.foundation/t/m-a-for-arbitrum-dao/23205,https://forum.arbitrum.foundation/u/bernard,2024-06-07,M&A for Arbitrum DAO
https://forum.arbitrum.foundation/t/aip-nova-fee-router-proposal-arbos-30/23310,https://forum.arbitrum.foundation/u/arbitrum,2024-06-07,AIP: Nova Fee Router Proposal (ArbOS 30)
https://forum.arbitrum.foundation/t/proposal-non-constitutional-set-up-a-sub-committee-for-the-security-services-subsidy-fund/23766,https://forum.arbitrum.foundation/u/immutablelawyer,2024-06-06,Proposal [Non-Constitutional]: Set up a Sub-Committee for the Security Services Subsidy Fund
https://forum.arbitrum.foundation/t/proposal-the-startup-collective-ecosystem-growth-in-arbitrum/24531,https://forum.arbitrum.foundation/u/scollen,2024-05-31,Proposal: The Startup Collective - Ecosystem Growth in Arbitrum.
https://forum.arbitrum.foundation/t/proposal-return-funds-to-arb-users-who-sent-their-airdrop-tokens-to-the-contract-address/11477,https://forum.arbitrum.foundation/u/welly,2024-05-30,Proposal: Return funds to arb users who sent their airdrop tokens to the contract address
https://forum.arbitrum.foundation/t/proposal-request-to-match-my-donation-to-boostrap-curve-lending-on-arbitrum/22975,https://forum.arbitrum.foundation/u/michwill,2024-05-30,Proposal: Request to match my donation to boostrap Curve Lending on Arbitrum
https://forum.arbitrum.foundation/t/non-constitutional-establish-a-short-term-marketing-program/23814,https://forum.arbitrum.foundation/u/404dao,2024-05-24,[Non-constitutional] Establish a Short Term Marketing Program
https://forum.arbitrum.foundation/t/double-down-on-stip-successes-stip-bridge/22353,https://forum.arbitrum.foundation/u/savvydao,2024-05-23,Double-Down on STIP Successes (STIP-Bridge)
https://forum.arbitrum.foundation/t/delegate-to-a-public-access-public-good-citizen-enfranchisement-pool-through-event-horizon/21523,https://forum.arbitrum.foundation/u/eventhorizondao,2024-05-22,"Delegate to a public access, public good citizen enfranchisement pool through Event Horizon"
https://forum.arbitrum.foundation/t/non-constitutional-subsidy-fund-for-security-services/22958,https://forum.arbitrum.foundation/u/bernard,2024-05-20,[Non-constitutional] Subsidy Fund for Security Services
https://forum.arbitrum.foundation/t/the-opco-scale-structure-synergy/22737,https://forum.arbitrum.foundation/u/dk3,2024-05-15,"The OpCo - Scale, Structure, & Synergy"
https://forum.arbitrum.foundation/t/proposal-activate-arb-staking-final/19068,https://forum.arbitrum.foundation/u/plutus,2024-05-12,Proposal: Activate ARB Staking (FINAL)
https://forum.arbitrum.foundation/t/proposal-non-constitutional-arbitrum-treasury-token-swap-program/23303,https://forum.arbitrum.foundation/u/thedevanshmehta,2024-05-07,Proposal [Non-Constitutional] Arbitrum Treasury Token Swap Program
https://forum.arbitrum.foundation/t/grant-proposal-for-migration-of-data2073-tcg/23644,https://forum.arbitrum.foundation/u/elkronner,2024-05-04,Grant Proposal for migration of DATA2073 TCG
https://forum.arbitrum.foundation/t/questbook-dda-program-phase-2-request-for-continuation/21326,https://forum.arbitrum.foundation/u/srijith-questbook,2024-04-20,Questbook DDA Program Phase 2 Request for Continuation
https://forum.arbitrum.foundation/t/proposal-distribution-of-dao-revenue-to-arb-token-holders/14412,https://forum.arbitrum.foundation/u/psy,2024-04-20,Proposal: Distribution of DAO Revenue to ARB Token Holders
https://forum.arbitrum.foundation/t/rfc-proposal-non-constitutional-establishment-of-arbitrum-ventures-initiative-avi/23222,https://forum.arbitrum.foundation/u/lino,2024-04-20,(RFC) Proposal: [Non-Constitutional]: Establishment of Arbitrum Ventures Initiative (AVI)
https://forum.arbitrum.foundation/t/proposal-event-horizon-community-governed-public-access-governance-delegation/19792,https://forum.arbitrum.foundation/u/eventhorizon,2024-04-18,"[PROPOSAL] Event Horizon Community Governed, Public-Access Governance Delegation"
https://forum.arbitrum.foundation/t/fees-sharing-with-decentralized-sequencer-using-arb-staking/19967,https://forum.arbitrum.foundation/u/boban,2024-04-18,Fees sharing with decentralized sequencer using $arb staking
https://forum.arbitrum.foundation/t/long-term-incentives-pilot-program/20223,https://forum.arbitrum.foundation/u/matt_stablelab,2024-04-16,Long Term Incentives Pilot Program
https://forum.arbitrum.foundation/t/rfc-empowering-underrepresented-delegates/22420,https://forum.arbitrum.foundation/u/mattonchain,2024-04-16,[RFC] Empowering Underrepresented Delegates
https://forum.arbitrum.foundation/t/l3-orbit-ecosystem-fund/22989,https://forum.arbitrum.foundation/u/cryptobyrde,2024-04-15,L3 Orbit Ecosystem Fund
https://forum.arbitrum.foundation/t/arbitrums-memecoin-fund/22743,https://forum.arbitrum.foundation/u/0xkawz,2024-04-13,Arbitrum’s Memecoin Fund
https://forum.arbitrum.foundation/t/non-constitutional-empowering-early-contributors-the-community-arbiter-proposal-2-0/20404,https://forum.arbitrum.foundation/u/mysterymen,2024-04-12,[Non-Constitutional]: Empowering Early Contributors: The community Arbiter Proposal 2.0
https://forum.arbitrum.foundation/t/proposal-non-constitutional-funding-dao-legal-defence-and-advocacy-with-defi-education-fund/23062,https://forum.arbitrum.foundation/u/gfxlabs,2024-04-08,Proposal [Non-Constitutional]: Funding DAO Legal Defence and Advocacy with Defi Education Fund
https://forum.arbitrum.foundation/t/final-arbitrum-stable-treasury-endowment-program/20139,https://forum.arbitrum.foundation/u/thedevanshmehta,2024-04-07,Final: Arbitrum Stable Treasury Endowment Program
https://forum.arbitrum.foundation/t/burstek-dao-initiative-advancing-africas-blockchain-frontier-with-arbitrum/20505,https://forum.arbitrum.foundation/u/agate,2024-04-03,Burstek DAO Initiative: Advancing Africa’s Blockchain Frontier with Arbitrum
https://forum.arbitrum.foundation/t/rfc-security-council-member-test/22809,https://forum.arbitrum.foundation/u/cattin,2024-04-02,RFC - Security Council Member Test
https://forum.arbitrum.foundation/t/idea-for-a-direct-user-rewards-program/22939,https://forum.arbitrum.foundation/u/ajc,2024-04-02,Idea for a Direct User Rewards Program
https://forum.arbitrum.foundation/t/proposal-non-constitutional-one-time-arb-donation-to-givewell-s-top-charities-fund/22328,https://forum.arbitrum.foundation/u/grangerincident,2024-04-01,Proposal [Non-constitutional]: One-Time ARB Donation to Givewell’s Top Charities Fund
https://forum.arbitrum.foundation/t/non-constitutional-proposal-to-fund-plurality-labs-milestone-1b-ridge/21332,https://forum.arbitrum.foundation/u/disruptionjoe,2024-03-27,[Non-constitutional] Proposal to fund Plurality Labs Milestone 1B(ridge)
https://forum.arbitrum.foundation/t/timeline-extension-for-stip-and-backfund-grantees/19819,https://forum.arbitrum.foundation/u/matt_stablelab,2024-03-25,Timeline Extension for STIP and Backfund Grantees
https://forum.arbitrum.foundation/t/accounting-for-votes-arb-that-locked-in-various-projects/22454,https://forum.arbitrum.foundation/u/cp0x,2024-03-16,Accounting for votes ARB that locked in various projects
https://forum.arbitrum.foundation/t/aip-arbos-version-20-atlas/20957,https://forum.arbitrum.foundation/u/arbitrum,2024-03-13,AIP: ArbOS Version 20 “Atlas”
https://forum.arbitrum.foundation/t/proposal-non-constitutional-funding-for-into-the-dungeons-machinata-a-pvp-digital-miniature-game/20806,https://forum.arbitrum.foundation/u/thechaingamer.eth,2024-02-27,Proposal: [Non-Constitutional] Funding for Into the Dungeons: Machinata - a PvP Digital Miniature Game
https://forum.arbitrum.foundation/t/aip-changes-to-the-constitution-and-the-security-council-election-process/20856,https://forum.arbitrum.foundation/u/arbitrum,2024-02-26,AIP: Changes to the Constitution and the Security Council Election Process
https://forum.arbitrum.foundation/t/proposal-non-constitutional-funding-for-into-the-dungeons-machinata-a-pvp-digital-miniature-game-v2/21025,https://forum.arbitrum.foundation/u/thechaingamer.eth,2024-02-21,Proposal: [Non-Constitutional] Funding for Into the Dungeons: Machinata - a PvP Digital Miniature Game V2
https://forum.arbitrum.foundation/t/arbitrum-day-2024-gas-free/21164,https://forum.arbitrum.foundation/u/augustus,2024-02-13,Arbitrum Day 2024: Gas Free
https://forum.arbitrum.foundation/t/aip-batch-poster-manager-and-sequencer-inbox-finality-fix/20995,https://forum.arbitrum.foundation/u/arbitrum,2024-02-12,AIP: Batch Poster Manager and Sequencer Inbox Finality Fix
https://forum.arbitrum.foundation/t/proposal-non-constitutional-establish-the-arbitrumdao-procurement-committee/20064,https://forum.arbitrum.foundation/u/immutablelawyer,2024-02-06,Proposal [Non-Constitutional]: Establish the ArbitrumDAO Procurement Committee
https://forum.arbitrum.foundation/t/proposal-to-backfund-successful-stip-proposals-savvy-dao-final/19046,https://forum.arbitrum.foundation/u/savvydao,2024-02-06,Proposal to Backfund Successful STIP Proposals (Savvy DAO) [FINAL]
https://forum.arbitrum.foundation/t/non-constitutional-thank-arb-by-plurality-labs-milestone-2-scaling-value-creation-in-the-dao/20534,https://forum.arbitrum.foundation/u/disruptionjoe,2024-02-02,[Non-Constitutional] Thank ARB by Plurality Labs - Milestone 2: Scaling Value Creation in the DAO
https://forum.arbitrum.foundation/t/aip-arbos-version-11/19696,https://forum.arbitrum.foundation/u/arbitrum,2024-02-02,AIP: ArbOS Version 11
https://forum.arbitrum.foundation/t/arbitrum-now-a-pragmatic-approach-for-the-moment/15779,https://forum.arbitrum.foundation/u/coinflip,2024-02-02,Arbitrum Now: a pragmatic approach for the Moment
https://forum.arbitrum.foundation/t/proposal-experiental-incentive-program-for-arbitrum-game-builders-for-discussion/20979,https://forum.arbitrum.foundation/u/blanklee,2024-01-31,Proposal: Experiental Incentive Program for Arbitrum Game Builders(for Discussion)
https://forum.arbitrum.foundation/t/rfc-reallocate-unclaimed-airdrop-tokens-for-future-incentives/17027,https://forum.arbitrum.foundation/u/itublockchain,2024-01-29,[RFC] Reallocate unclaimed airdrop tokens for future incentives
https://forum.arbitrum.foundation/t/proposal-non-constitutional-establish-the-arbitrum-research-development-collective/19899,https://forum.arbitrum.foundation/u/immutablelawyer,2024-01-29,Proposal [Non-Constitutional]: Establish the ‘Arbitrum Research & Development Collective’
https://forum.arbitrum.foundation/t/the-defiant-1-ranked-crypto-101-education-onboarding-series/20832,https://forum.arbitrum.foundation/u/thedefiant,2024-01-26,The Defiant: #1 Ranked Crypto 101 Education & Onboarding Series
https://forum.arbitrum.foundation/t/proposal-experimental-incentive-system-for-active-arbitrumdao-delegates/19467,https://forum.arbitrum.foundation/u/cattin,2024-01-24,Proposal: Experimental Incentive System for Active ArbitrumDAO Delegates
https://forum.arbitrum.foundation/t/proposal-permissionless-orderbook-exchange/20681,https://forum.arbitrum.foundation/u/elixexo,2024-01-18,[Proposal] Permissionless Orderbook Exchange
https://forum.arbitrum.foundation/t/aip-6-security-council-elections/15425,https://forum.arbitrum.foundation/u/arbitrum,2024-01-09,AIP - 6 : Security Council Elections
https://forum.arbitrum.foundation/t/proposal-expand-metaverse-capacities-of-arbitrum-final/13614,https://forum.arbitrum.foundation/u/scalene,2024-01-03,Proposal: Expand Metaverse Capacities of Arbitrum (FINAL)
https://forum.arbitrum.foundation/t/proposal-building-the-future-of-nfts-the-rarible-protocol-arbitrum-integration-proposal-revised/15615,https://forum.arbitrum.foundation/u/janabe,2023-12-01,Proposal: Building the Future of NFTs: The Rarible Protocol - Arbitrum Integration Proposal [REVISED]
https://forum.arbitrum.foundation/t/proposal-transforming-arbitrums-financial-ecosystem-enhancing-sustainable-growth-and-innovation-through-sushiswap-s-bond-program/16456,https://forum.arbitrum.foundation/u/sushi,2023-12-01,Proposal: Transforming Arbitrum’s Financial Ecosystem – Enhancing Sustainable Growth and Innovation through SushiSwap’s Bond Program
https://forum.arbitrum.foundation/t/proposal-direct-all-unused-validator-revenue-to-a-permanent-ecosystem-fund/20289,https://forum.arbitrum.foundation/u/nach211,2023-12-01,Proposal: Direct ALL Unused Validator Revenue to a Permanent Ecosystem Fund
https://forum.arbitrum.foundation/t/proposal-allow-access-to-l1-block-hash/15925,https://forum.arbitrum.foundation/u/zemse,2023-12-01,Proposal: Allow access to L1 block hash
https://forum.arbitrum.foundation/t/proposal-the-arbitrum-coalition/19145,https://forum.arbitrum.foundation/u/blockworksresearch,2023-12-01,Proposal: The Arbitrum Coalition
https://forum.arbitrum.foundation/t/arbitrums-short-term-incentive-program-arbitrum-improvement-proposal/16131,https://forum.arbitrum.foundation/u/tnorm,2023-12-01,Arbitrum’s Short-Term Incentive Program (Arbitrum Improvement Proposal)
https://forum.arbitrum.foundation/t/non-constitutional-aip-proposal-arbitrum-ecosystem-security-bugs-audits/19924,https://forum.arbitrum.foundation/u/hen_immunefi,2023-12-01,Non-Constitutional AIP/Proposal: Arbitrum Ecosystem Security (Bugs + Audits)
https://forum.arbitrum.foundation/t/proposal-to-onboard-matrixed-link-as-a-validator-for-arbitrum-one/15387,https://forum.arbitrum.foundation/u/kubilay_matrixedlink,2023-12-01,Proposal to onboard Matrixed.Link as a validator for Arbitrum One
https://forum.arbitrum.foundation/t/draft-introduction-selection-and-guidelines-for-the-governance-facilitator-role/19816,https://forum.arbitrum.foundation/u/cattin,2023-12-01,"[DRAFT] Introduction, selection, and guidelines for the Governance Facilitator role"
https://forum.arbitrum.foundation/t/proposal-banklessdaos-global-education-and-onboarding-campaign-for-arbitrum/19653,https://forum.arbitrum.foundation/u/jengajojo,2023-12-01,Proposal: BanklessDAO’s Global Education and Onboarding Campaign for Arbitrum
https://forum.arbitrum.foundation/t/proposal-procurement-framework-security-non-constitutional-proposal-prev-rfp/19328,https://forum.arbitrum.foundation/u/dk3,2023-12-01,[PROPOSAL] - Procurement Framework | Security : Non-Constitutional Proposal (Prev RFP)
https://forum.arbitrum.foundation/t/proposal-non-constitutional-procurement-framework-security-service-providers/19704,https://forum.arbitrum.foundation/u/immutablelawyer,2023-12-01,Proposal [Non-Constitutional]: **Procurement Framework [Security Service Providers]**
https://forum.arbitrum.foundation/t/proposal-empowering-early-contributors-the-community-arbiter-proposal/18557,https://forum.arbitrum.foundation/u/mysterymen,2023-12-01,Proposal: Empowering Early Contributors: The community Arbiter Proposal
https://forum.arbitrum.foundation/t/proposal-grow-arbitrum-stip-teams-by-leveraging-quest-protocol-built-by-rabbithole/19185,https://forum.arbitrum.foundation/u/bflynn,2023-11-01,Proposal: Grow Arbitrum & STIP Teams by leveraging Quest Protocol built by RabbitHole
https://forum.arbitrum.foundation/t/proposal-for-funding-gas-rebate-and-trading-competition-program-to-amplify-arbitrum-s-ecosystem-growth/19330,https://forum.arbitrum.foundation/u/soby,2023-11-01,Proposal for Funding Gas Rebate and Trading Competition Program to Amplify Arbitrum’s Ecosystem Growth
https://forum.arbitrum.foundation/t/proposal-register-insure-token-to-arb-bridge/19124,https://forum.arbitrum.foundation/u/kohshiba,2023-11-01,Proposal: Register INSURE token to ARB Bridge
https://forum.arbitrum.foundation/t/non-constitutional-aip-ecosystem-security-fund/19300,https://forum.arbitrum.foundation/u/sherlock,2023-11-01,Non-Constitutional AIP: Ecosystem Security Fund
https://forum.arbitrum.foundation/t/non-constitutional-aip-arbitrum-security-enhancement-fund/19161,https://forum.arbitrum.foundation/u/cyfrin,2023-11-01,Non-Constitutional AIP: Arbitrum Security Enhancement Fund
https://forum.arbitrum.foundation/t/draft-non-constitutional-aip-continuous-ecosystem-security-provision/19206,https://forum.arbitrum.foundation/u/dedaub,2023-11-01,[Draft] Non-Constitutional AIP: Continuous Ecosystem Security Provision
https://forum.arbitrum.foundation/t/proposal-build-optimal-onboarding-for-stip-teams-boost/19114,https://forum.arbitrum.foundation/u/limes,2023-11-01,Proposal: Build Optimal Onboarding for STIP Teams (BOOST)
https://forum.arbitrum.foundation/t/proposal-arbitrum-and-slash-payment-in-the-asian-payment-market/19238,https://forum.arbitrum.foundation/u/slashfintech,2023-10-01,[Proposal] Arbitrum and Slash Payment in the Asian payment market
https://forum.arbitrum.foundation/t/request-for-feedback-when-and-how-should-the-arbitrum-foundation-issue-a-licence-for-the-arbitrum-technology-stack-to-a-new-strategic-partner/15758,https://forum.arbitrum.foundation/u/stonecoldpat,2023-10-01,"Request for Feedback: When, and How, Should the Arbitrum Foundation Issue a Licence for the Arbitrum Technology Stack to a New Strategic Partner"
https://forum.arbitrum.foundation/t/proposal-dapps-over-apps/19081,https://forum.arbitrum.foundation/u/supercoolkay,2023-10-01,[Proposal] Dapps over Apps
https://forum.arbitrum.foundation/t/proposal-to-blacklist-systematic-scammers-and-refund-victims-who-could-not-claim-their-arb-airdrop/13246,https://forum.arbitrum.foundation/u/cryptocafe,2023-10-01,Proposal to Blacklist Systematic Scammers and refund victims who could not claim their ARB airdrop
https://forum.arbitrum.foundation/t/return-funds-to-those-individuals-who-were-affected-by-the-webhook-bot-in-the-dev-announcements-channel/18953,https://forum.arbitrum.foundation/u/hairaa,2023-10-01,Return funds to those individuals who were affected by the webhook bot in the Dev-Announcements channel
https://forum.arbitrum.foundation/t/proposal-arbitrum-as-official-sponsor-of-ethereum-mexico-2023/16279,https://forum.arbitrum.foundation/u/brichis,2023-10-01,Proposal: Arbitrum as official sponsor of Ethereum Mexico 2023
https://forum.arbitrum.foundation/t/draft-experimental-incentive-system-for-active-arbitrumdao-delegates/16501,https://forum.arbitrum.foundation/u/cattin,2023-09-01,[DRAFT] Experimental Incentive System for Active ArbitrumDAO Delegates
https://forum.arbitrum.foundation/t/temperature-check-request-for-consideration-on-late-arb-token-claim/17313,https://forum.arbitrum.foundation/u/magdal3na,2023-09-01,[Temperature Check] Request for Consideration on Late ARB Token Claim
https://forum.arbitrum.foundation/t/proposal-fund-arbitrum-odyssey-2-0-airdrop/15985,https://forum.arbitrum.foundation/u/0xac,2023-09-01,Proposal: Fund Arbitrum Odyssey 2.0 Airdrop
https://forum.arbitrum.foundation/t/rfc-2-delegate-incentive-system-for-arbitrumdao/15720,https://forum.arbitrum.foundation/u/cattin,2023-09-01,[RFC-2] Delegate Incentive System for ArbitrumDAO
