Link,Author,Release Date,Title
https://forum.arbitrum.foundation/t/request-for-comment-proposal-to-activate-arb-staking/16240,https://forum.arbitrum.foundation/u/plutus,2023-09-01,Request for Comment: Proposal to Activate ARB Staking
https://forum.arbitrum.foundation/t/proposal-accelerating-arbitrum-leveraging-camelot-as-an-ecosystem-hub-to-support-native-builders/15116,https://forum.arbitrum.foundation/u/camelot,2023-09-01,Proposal: Accelerating Arbitrum - leveraging Camelot as an ecosystem hub to support native builders
https://forum.arbitrum.foundation/t/proposal-decrease-censorship-delay-from-24-hours-to-4-hours/13047,https://forum.arbitrum.foundation/u/shotaro,2023-09-01,Proposal: Decrease Censorship Delay from 24 hours to 4 hours
https://forum.arbitrum.foundation/t/proposal-non-constitutional-allow-the-pl-arb-grants-safety-multisig-to-trade-arb-for-sequencer-fee-eth/16223,https://forum.arbitrum.foundation/u/disruptionjoe,2023-09-01,Proposal: [Non-constitutional] Allow the PL-ARB Grants Safety Multisig to trade ARB for sequencer fee ETH
https://forum.arbitrum.foundation/t/rfc-3-introduction-of-a-new-role-in-governance-governance-facilitator/15716,https://forum.arbitrum.foundation/u/cattin,2023-09-01,[RFC-3] Introduction of a new role in governance - Governance Facilitator
https://forum.arbitrum.foundation/t/proposal-fund-atomas-project-a-growth-communications-proposal-for-arbitrum/16165,https://forum.arbitrum.foundation/u/sebix,2023-09-01,"Proposal: Fund Atoma’s project, a Growth & Communications proposal for Arbitrum"
https://forum.arbitrum.foundation/t/proposal-arbitrum-grants-dao/15273,https://forum.arbitrum.foundation/u/helloshreyas,2023-09-01,Proposal: Arbitrum Grants DAO
https://forum.arbitrum.foundation/t/aip-7-arbitrum-one-governance-parameter-fixes/15920,https://forum.arbitrum.foundation/u/arbitrum,2023-09-01,AIP-7: Arbitrum One Governance parameter fixes
https://forum.arbitrum.foundation/t/proposal-time-management-in-arbitrum-s-governance/15941,https://forum.arbitrum.foundation/u/cattin,2023-09-01,Proposal: Time Management in Arbitrum’s Governance
https://forum.arbitrum.foundation/t/development-maintenance-of-virtual-and-face-to-face-communities-regarding-the-arbitrum-ecosystem-for-venezuela-and-argentina/16101,https://forum.arbitrum.foundation/u/venehsoftw,2023-08-01,Development/Maintenance of virtual and face-to-face communities regarding the Arbitrum Ecosystem for Venezuela and Argentina.
https://forum.arbitrum.foundation/t/proposal-on-hackathon-development-for-venezuela/16083,https://forum.arbitrum.foundation/u/venehsoftw,2023-08-01,Proposal on Hackathon development for Venezuela
https://forum.arbitrum.foundation/t/proposal-update-security-council-election-start-date-to-ensure-time-for-security-audit/15426,https://forum.arbitrum.foundation/u/arbitrum,2023-08-01,Proposal: Update Security Council Election Start Date to Ensure Time for Security Audit
https://forum.arbitrum.foundation/t/aip-3-non-constitutional-fund-the-arbitrum-grants-framework-proposal-milestone-1/14976,https://forum.arbitrum.foundation/u/disruptionjoe,2023-08-01,AIP - 3 [Non-Constitutional] Fund the Arbitrum Grants Framework Proposal Milestone 1
https://forum.arbitrum.foundation/t/rfc-0-comprehensive-proposal-for-modifications-in-arbitrumdaos-governance-infrastructure/15719,https://forum.arbitrum.foundation/u/cattin,2023-08-01,[RFC-0] Comprehensive Proposal for Modifications in ArbitrumDAO’s Governance Infrastructure
https://forum.arbitrum.foundation/t/delegated-domain-allocation-by-questbook-arbitrum-dao-grants/14688,https://forum.arbitrum.foundation/u/saurabh,2023-08-01,Delegated Domain Allocation by Questbook - Arbitrum DAO Grants
https://forum.arbitrum.foundation/t/rfc-1-time-management-in-arbitrumdao-governance/15718,https://forum.arbitrum.foundation/u/cattin,2023-08-01,[RFC-1] Time Management in ArbitrumDAO Governance
https://forum.arbitrum.foundation/t/proposal-idgo-a-local-passport-and-gift-card-system-on-the-arbitrum-network/15553,https://forum.arbitrum.foundation/u/blair,2023-08-01,Proposal: IDGO - A Local Passport and Gift Card System on the Arbitrum Network
https://forum.arbitrum.foundation/t/proposal-request-for-comment-recognizing-and-rewarding-offchain-labs-hackathon-participants-and-github-contributors-through-the-arbitrum-dao/15384,https://forum.arbitrum.foundation/u/0x_buidler,2023-07-01,[Proposal: Request for comment] : Recognizing and Rewarding Offchain Labs’ Hackathon Participants and GitHub Contributors through the Arbitrum DAO
https://forum.arbitrum.foundation/t/proposal-high-council-x-arbitrum-for-advancing-decentralized-collaboration-and-governance/15300,https://forum.arbitrum.foundation/u/spop,2023-07-01,Proposal: High Council x Arbitrum for advancing decentralized collaboration and governance
https://forum.arbitrum.foundation/t/aip-2-activate-support-for-account-abstraction-endpoint-on-one-and-nova/14790,https://forum.arbitrum.foundation/u/jasonw,2023-07-01,AIP-2: Activate support for account abstraction endpoint on One and Nova
https://forum.arbitrum.foundation/t/proposal-arbitrum-interactive-specs-opcodes-precompiles-etc/14701,https://forum.arbitrum.foundation/u/zhivkoto,2023-06-01,"Proposal: Arbitrum Interactive Specs - opcodes, precompiles etc"
https://forum.arbitrum.foundation/t/proposal-building-the-future-of-nfts-the-rarible-protocol-arbitrum-integration-proposal/15091,https://forum.arbitrum.foundation/u/janabe,2023-06-01,Proposal: Building the Future of NFTs: The Rarible Protocol - Arbitrum Integration Proposal
https://forum.arbitrum.foundation/t/proposal-aip-1-2-foundation-and-dao-governance/13362,https://forum.arbitrum.foundation/u/arbitrum,2023-06-01,Proposal: AIP-1.2 - Foundation and DAO Governance
https://forum.arbitrum.foundation/t/proposal-aip-1-1-lockup-budget-transparency/13360,https://forum.arbitrum.foundation/u/arbitrum,2023-06-01,"Proposal: AIP-1.1 - Lockup, Budget, Transparency"
https://forum.arbitrum.foundation/t/request-for-comment-draft-proposal-building-a-pluralist-grants-framework-milestone-1/14730,https://forum.arbitrum.foundation/u/disruptionjoe,2023-06-01,[Request for Comment - Draft Proposal] Building a Pluralist Grants Framework - Milestone 1
https://forum.arbitrum.foundation/t/proposal-temp-check-mission-of-the-arbitrum-dao-constitutional/14926,https://forum.arbitrum.foundation/u/jengajojo,2023-06-01,Proposal: Temp check - Mission of the Arbitrum DAO [Constitutional]
https://forum.arbitrum.foundation/t/proposal-for-change-of-gradual-unlocking-of-arbitrum-tokens-to-sustain-ecosystem-value/14907,https://forum.arbitrum.foundation/u/csarb,2023-06-01,Proposal for change of gradual Unlocking of Arbitrum Tokens to Sustain Ecosystem Value
https://forum.arbitrum.foundation/t/proposal-distributing-arb-tokens-to-l3-mxc-zkevm-users-to-encourage-growth-on-arbitrum-one/14598,https://forum.arbitrum.foundation/u/sheenhx,2023-06-01,Proposal: Distributing ARB Tokens to L3 MXC zkEVM Users to Encourage Growth on Arbitrum One
https://forum.arbitrum.foundation/t/return-funds-to-those-individuals-who-were-affected-by-the-webhook-bot-in-the-dev-announcements-channel-on-25th-march/12718,https://forum.arbitrum.foundation/u/hairaa,2023-06-01,"Return funds to those individuals who were affected by the webhook bot in the Dev-Announcements channel on 25th, March"
https://forum.arbitrum.foundation/t/allocation-of-10-of-gas-fees-for-health-insurance-claims/14519,https://forum.arbitrum.foundation/u/iamoracle,2023-05-01,Allocation of 10% of Gas Fees for Health Insurance Claims
https://forum.arbitrum.foundation/t/proposal-a-proposal-for-arb-token-airdrop-to-early-arbitrum-devcon-hackathon-participants-and-github-contributors/12561,https://forum.arbitrum.foundation/u/0x_buidler,2023-05-01,Proposal: A Proposal for ARB Token Airdrop to Early Arbitrum Devcon Hackathon Participants and GitHub Contributors
https://forum.arbitrum.foundation/t/proposal-include-lps-in-gov-voting/11615,https://forum.arbitrum.foundation/u/ceazor,2023-05-01,Proposal: Include LPs in Gov Voting
https://forum.arbitrum.foundation/t/proposal-request-for-inclusion-in-arbitrum-dao-airdrop-for-pickle-finance/13873,https://forum.arbitrum.foundation/u/larry,2023-05-01,Proposal: Request for Inclusion in Arbitrum DAO Airdrop for Pickle Finance
https://forum.arbitrum.foundation/t/proposal-token-vesting-requirement-for-dao-members/12033,https://forum.arbitrum.foundation/u/cryptonick,2023-05-01,Proposal: Token Vesting Requirement for DAO Members
https://forum.arbitrum.foundation/t/proposal-count-arb-balance-in-qidao-vaults-into-voting-power/13949,https://forum.arbitrum.foundation/u/benjamin.lens,2023-05-01,Proposal: Count ARB Balance in QiDao Vaults into Voting Power
https://forum.arbitrum.foundation/t/arbitrum-loyalty-program-proposal/5611,https://forum.arbitrum.foundation/u/akharito,2023-05-01,Arbitrum loyalty program proposal
https://forum.arbitrum.foundation/t/partnership-proposal-to-arbitrum-dao/14260,https://forum.arbitrum.foundation/u/0xweston,2023-05-01,Partnership Proposal to Arbitrum DAO
https://forum.arbitrum.foundation/t/aip-1-arbitrum-improvement-proposal-framework/30,https://forum.arbitrum.foundation/u/arbitrum,2023-04-01,AIP-1: Arbitrum Improvement Proposal Framework
https://forum.arbitrum.foundation/t/proposal-return-700m-arb-to-the-dao-treasury/13490,https://forum.arbitrum.foundation/u/thiccythot,2023-04-01,Proposal: Return 700M $ARB to the DAO Treasury
https://forum.arbitrum.foundation/t/proposal-delete-the-dao-and-remove-the-governance-capabilities-of-arb/13015,https://forum.arbitrum.foundation/u/xdrasticmirror,2023-04-01,Proposal: Delete the DAO and remove the governance capabilities of $ARB
https://forum.arbitrum.foundation/t/clarity-around-the-ratification-of-aip-1/12864,https://forum.arbitrum.foundation/u/stonecoldpat,2023-04-01,Clarity around the ratification of AIP-1
https://forum.arbitrum.foundation/t/proposal-setting-up-the-first-arbitrum-community-house-in-the-greater-helsinki-region-in-finland/12799,https://forum.arbitrum.foundation/u/roinevirta,2023-04-01,Proposal: Setting up the first Arbitrum Community House in the Greater Helsinki region in Finland
https://forum.arbitrum.foundation/t/proposal-remove-trending-delegates-from-tally-xyz/12428,https://forum.arbitrum.foundation/u/cryptonick,2023-04-01,Proposal: Remove “Trending Delegates” from tally.xyz
https://forum.arbitrum.foundation/t/remedying-the-aip-1-situation-and-offering-a-buy-back-of-arb/12918,https://forum.arbitrum.foundation/u/splitcapital,2023-04-01,Remedying the AIP-1 Situation and offering a buy back of $ARB
