Link,Author,Release Date,Title
https://forum.cow.fi/t/about-the-technical-category/1,https://forum.cow.fi/u/system,2022-01-01,About the Technical category
https://forum.cow.fi/t/towards-formalizing-ebbo-rules/2415,https://forum.cow.fi/u/felixhenneke,2024-05-10,Towards formalizing EBBO rules
https://forum.cow.fi/t/path-to-l2-deployments/1774,https://forum.cow.fi/u/fleupold,2024-02-20,Path to L2 Deployments
https://forum.cow.fi/t/proposal-cow-specific-smart-contract-wallet-with-2-keys-with-differing-roles-withdraw-trade/2198,https://forum.cow.fi/u/mookow4eva,2024-01-25,Proposal: COW-specific Smart Contract Wallet with 2 keys with differing roles (withdraw+trade)
https://forum.cow.fi/t/move-solver-rewards-mechanism-from-theory-to-practice/1850,https://forum.cow.fi/u/filius,2023-11-01,Move Solver Rewards Mechanism from Theory to Practice
https://forum.cow.fi/t/implementing-liquidations-using-cow-protocol/1922,https://forum.cow.fi/u/fleupold,2023-10-01,Implementing Liquidations using CoW Protocol
https://forum.cow.fi/t/guidelines-for-solver-computed-fees-for-long-standing-limit-orders-as-implied-by-past-cips/1921,https://forum.cow.fi/u/harisang,2023-09-01,Guidelines for solver-computed fees for long-standing limit orders as implied by past CIPs
https://forum.cow.fi/t/measuring-and-banning-overbidding/1874,https://forum.cow.fi/u/felixhenneke,2023-08-01,Measuring and banning overbidding
https://forum.cow.fi/t/fast-liquidity-in-cow/1841,https://forum.cow.fi/u/mohammed,2023-07-01,Fast Liquidity in CoW
https://forum.cow.fi/t/automated-treasury-management-methodology/1799,https://forum.cow.fi/u/mfw78,2023-07-01,Automated Treasury Management Methodology
https://forum.cow.fi/t/merge-settlement-contract-and-uni-v4/1769,https://forum.cow.fi/u/cowry,2023-07-01,Merge Settlement contract and uni v4
https://forum.cow.fi/t/how-do-i-withdraw-money-from-cow-swap-my-moneys-stuck/1768,https://forum.cow.fi/u/alsf4,2023-06-01,How do I withdraw money from cow swap my moneys stuck
https://forum.cow.fi/t/using-flash-loans-inside-cow-swap-settlements/1706,https://forum.cow.fi/u/fleupold,2023-06-01,Using Flash Loans inside CoW Swap Settlements
https://forum.cow.fi/t/towards-a-stronger-price-estimation-competition/1699,https://forum.cow.fi/u/harisang,2023-06-01,Towards a stronger price estimation competition
https://forum.cow.fi/t/surplus-capturing-amm-study-results/1650,https://forum.cow.fi/u/0xevan,2023-05-01,Surplus-Capturing AMM Study Results
https://forum.cow.fi/t/utilization-of-mev-blocker-kickbacks-from-cow-settlements/1652,https://forum.cow.fi/u/fleupold,2023-04-01,Utilization of MEV Blocker Kickbacks from CoW Settlements
https://forum.cow.fi/t/report-on-the-first-two-weeks-of-cip-20/1630,https://forum.cow.fi/u/felixhenneke,2023-04-01,Report on the first two weeks of CIP-20
https://forum.cow.fi/t/surplus-maximizing-vs-volume-maximizing-partially-fillable-limit-orders/1482,https://forum.cow.fi/u/harisang,2023-03-01,Surplus-maximizing VS Volume-maximizing Partially Fillable Limit orders
https://forum.cow.fi/t/a-2nd-price-solver-competition/1295,https://forum.cow.fi/u/maxholloway,2023-02-01,A 2nd Price Solver Competition
https://forum.cow.fi/t/relationship-between-solver-searcher-and-builder/1449,https://forum.cow.fi/u/koeppelmann,2023-02-01,Relationship between Solver <-> Searcher <-> and builder
https://forum.cow.fi/t/cow-native-amms-aka-surplus-capturing-amms-with-single-price-clearing/1219,https://forum.cow.fi/u/fleupold,2022-12-01,CoW Native AMMs (aka Surplus Capturing AMMs with single price clearing)
https://forum.cow.fi/t/looking-for-existing-solver-to-integrate-the-most-efficient-dex-aggregator-openocean/1256,https://forum.cow.fi/u/oliveropenocean,2022-11-01,Looking for Existing Solver to Integrate the most efficient DEX Aggregator - OpenOcean
https://forum.cow.fi/t/a-vickrey-style-auction-mechanism-for-the-solver-competition/1102,https://forum.cow.fi/u/tbosman,2022-11-01,A Vickrey style auction mechanism for the solver competition
https://forum.cow.fi/t/pennying-as-a-strategy-to-win-more-auctions-and-how-to-deal-with-it/1093,https://forum.cow.fi/u/harisang,2022-09-01,"“Pennying” as a strategy to win more auctions, and how to deal with it"
https://forum.cow.fi/t/bufferable-tokens-list/1122,https://forum.cow.fi/u/filius,2022-09-01,Bufferable Tokens List
https://forum.cow.fi/t/a-token-conservation-test-for-preventing-unfair-surplus-shifting/1007,https://forum.cow.fi/u/harisang,2022-07-01,A token conservation test for preventing unfair surplus shifting
https://forum.cow.fi/t/ideas-for-ensuring-fair-solutions-envy-freeness-of-amms-and-capped-surplus/1029,https://forum.cow.fi/u/tom,2022-06-01,Ideas for ensuring fair solutions: envy-freeness of AMMs and capped surplus
https://forum.cow.fi/t/implementing-a-solver-using-private-liquidity/974,https://forum.cow.fi/u/fleupold,2022-05-01,Implementing a solver using private liquidity
https://forum.cow.fi/t/simple-stable-coin-market-making-bot/602,https://forum.cow.fi/u/koeppelmann,2022-04-01,Simple stable coin market making bot
https://forum.cow.fi/t/solver-selection-and-benchmarking/901,https://forum.cow.fi/u/filius,2022-04-01,Solver Selection and Benchmarking
https://forum.cow.fi/t/technical-challenges-on-implementing-limit-orders/771,https://forum.cow.fi/u/defiparasite,2022-03-01,Technical challenges on implementing limit orders
