Link,Author,Release Date,Title
https://forum.dymension.xyz/t/about-the-rollapps-central-category/28,https://forum.dymension.xyz/u/orjah,2023-07-01,About the RollApps Central category
https://forum.dymension.xyz/t/introducing-rivalz-network-the-first-ai-depin-rollapp-on-dymension/2737,https://forum.dymension.xyz/u/rivalz,2024-03-31,"Introducing Rivalz Network, the first AI DePIN RollApp on Dymension"
https://forum.dymension.xyz/t/rollapp-submission-introducing-aigisos-rollapp-a-security-oriented-blockchain-with-a-novel-consensus-algorithm-on-dymension/1568,https://forum.dymension.xyz/u/sch89,2024-03-28,"[RollApp Submission] Introducing Aigisos RollApp, a security oriented blockchain with a novel consensus algorithm on Dymension"
https://forum.dymension.xyz/t/rollapp-submission-introducing-dogmond-the-first-memecoin-rollup-on-dymension/2012,https://forum.dymension.xyz/u/dogmond,2024-03-26,[RollApp Submission] Introducing Dogmond the first memecoin rollup on Dymension!
https://forum.dymension.xyz/t/rollapp-submission-introducing-nim-network-the-first-rollapp-on-dymension/1236,https://forum.dymension.xyz/u/nim,2024-03-21,[RollApp Submission] Introducing NIM Network The First RollApp On Dymension
