Link,Author,Release Date,Title
https://forum.dymension.xyz/t/about-the-community-huddle-category/27,https://forum.dymension.xyz/u/orjah,2023-12-01,About the Community Huddle category
https://forum.dymension.xyz/t/introducing-block-explorer-project-for-rollapps/3292,https://forum.dymension.xyz/u/0xbcdev,2024-04-21,Introducing Block Explorer project for RollApps
https://forum.dymension.xyz/t/proposal-for-a-more-inclusive-reward-system-for-froopyland-incentivized-testnet/2977,https://forum.dymension.xyz/u/ahmkah,2024-04-07,Proposal for a More Inclusive Reward System for Froopyland Incentivized Testnet
https://forum.dymension.xyz/t/keep-dymension-clean-and-professional/2338,https://forum.dymension.xyz/u/telijalad,2024-04-02,Keep Dymension clean and professional
https://forum.dymension.xyz/t/dymension-season/2594,https://forum.dymension.xyz/u/bigcharlie,2024-03-30,Dymension season
https://forum.dymension.xyz/t/airdrop-not-received/515,https://forum.dymension.xyz/u/dgnscan,2024-03-28,Airdrop not received
https://forum.dymension.xyz/t/new-dymension-salt-chart-just-dropped/517,https://forum.dymension.xyz/u/derp,2024-03-23,New Dymension salt chart just dropped
https://forum.dymension.xyz/t/dym-disappeared-from-staking/519,https://forum.dymension.xyz/u/alien,2024-03-23,Dym disappeared from staking
https://forum.dymension.xyz/t/great-to-be-here-let-keep-grinding/111,https://forum.dymension.xyz/u/jefferdex,2024-03-15,Great to be here. Let keep grinding
https://forum.dymension.xyz/t/proposal-voting-with-metamask/247,https://forum.dymension.xyz/u/coinholder,2024-03-08,Proposal voting with Metamask
https://forum.dymension.xyz/t/deep-evm-integration/1912,https://forum.dymension.xyz/u/sdbs,2024-03-08,Deep EVM integration
https://forum.dymension.xyz/t/sharing-infrastructure-best-practices-for-running-validators-on-cosmos-based-chains-like-dymension/795,https://forum.dymension.xyz/u/kiln,2024-03-07,Sharing infrastructure best practices for running validators on Cosmos-based chains like Dymension
https://forum.dymension.xyz/t/airdrop-wallet-address-compromised/205,https://forum.dymension.xyz/u/erwingithub2,2024-02-14,Airdrop wallet address compromised
https://forum.dymension.xyz/t/validators-utilizing-cosmos-validator-watcher-for-enhanced-dymension-chain-monitoring/594,https://forum.dymension.xyz/u/kiln,2024-02-13,[Validators] Utilizing Cosmos Validator Watcher for Enhanced Dymension Chain Monitoring
https://forum.dymension.xyz/t/i-believe-modularization-is-the-future-trend-currently-if-a-developer-needs-to-develop-a-chain-separately-the-cost-is-too-high/124,https://forum.dymension.xyz/u/harodggg,2024-02-11,"I believe modularization is the future trend. Currently, if a developer needs to develop a chain separately, the cost is too high"
https://forum.dymension.xyz/t/ibc-transfer-is-very-slow/145,https://forum.dymension.xyz/u/toglok,2024-02-11,Ibc transfer is very slow
https://forum.dymension.xyz/t/ibc-transfer-dym-problem-or-out/229,https://forum.dymension.xyz/u/nicoleym,2024-02-11,IBC transfer dym problem or out
https://forum.dymension.xyz/t/help-solana-claimoors/231,https://forum.dymension.xyz/u/insanemogul,2024-02-11,Help solana claimoors
https://forum.dymension.xyz/t/missing-airdrop-allocation/518,https://forum.dymension.xyz/u/a_big_nurb,2024-02-11,Missing airdrop allocation
https://forum.dymension.xyz/t/include-pstake-s-stkatom-for-dym-airdrop/174,https://forum.dymension.xyz/u/pstake_finance,2024-02-11,Include pSTAKE’s stkATOM for DYM Airdrop
https://forum.dymension.xyz/t/issue-with-airdrop-and-metamask-address/516,https://forum.dymension.xyz/u/pistolevg,2024-02-11,Issue with airdrop and Metamask address
https://forum.dymension.xyz/t/proposal-for-inclusive-airdrop-rules-for-high-stake-supporters-in-the-ecosystem/165,https://forum.dymension.xyz/u/mechul-eth,2024-02-11,Proposal for Inclusive Airdrop Rules for High-Stake Supporters in the Ecosystem
https://forum.dymension.xyz/t/ibc-and-dymension/133,https://forum.dymension.xyz/u/francismbaka,2023-12-01,IBC and dymension
