Link,Author,Release Date,Title
https://forum.eigenlayer.xyz/t/the-mechanics-of-allocating-and-slashing-unique-stake/13870,https://forum.eigenlayer.xyz/u/bmpalatiello,2025-01-29,The Mechanics of Allocating and Slashing Unique Stake
https://forum.eigenlayer.xyz/t/deploying-any-erc-20-on-eigenlayer-in-30-seconds/14359,https://forum.eigenlayer.xyz/u/bmpalatiello,2025-01-28,Deploying any ERC-20 on EigenLayer in 30 seconds
https://forum.eigenlayer.xyz/t/there-is-no-global-veto-committee-on-eigenlayer/14339,https://forum.eigenlayer.xyz/u/bmpalatiello,2025-01-07,There is no global veto committee on EigenLayer
https://forum.eigenlayer.xyz/t/stake-guarantee-window/14245,https://forum.eigenlayer.xyz/u/bmpalatiello,2024-12-01,Stake Guarantee Window
https://forum.eigenlayer.xyz/t/introducing-the-eigen-labs-research-team/13843,https://forum.eigenlayer.xyz/u/brandon,2024-09-01,Introducing the Eigen Labs Research Team
https://forum.eigenlayer.xyz/t/the-double-edged-sword-risks-around-eigenlayers-seasonal-airdrops/13862,https://forum.eigenlayer.xyz/u/yieldnestrisk,2024-09-01,The Double-Edged Sword: Risks Around EigenLayer’s Seasonal Airdrops
https://forum.eigenlayer.xyz/t/optimistic-delegation-framework-idea-to-allow-for-native-restaking-without-delegation/12198,https://forum.eigenlayer.xyz/u/drewvanderwerff,2024-09-01,Optimistic Delegation Framework - Idea to Allow for Native Restaking Without Delegation
https://forum.eigenlayer.xyz/t/rewards-release-v1-avs-rewards-for-operators-and-stakers/14200,https://forum.eigenlayer.xyz/u/system,2024-06-01,Rewards Release V1: AVS rewards for operators and stakers
https://forum.eigenlayer.xyz/t/in-what-currency-will-or-should-restaking-rewards-be-paid/12473,https://forum.eigenlayer.xyz/u/labdogeth,2024-01-01,In what currency will (or should) restaking rewards be paid?
https://forum.eigenlayer.xyz/t/proposal-staker-driven-module-evaluation-and-risk-assessment-framework/12186,https://forum.eigenlayer.xyz/u/tudorpintea999,2023-11-01,Proposal: Staker-Driven Module Evaluation and Risk Assessment Framework
https://forum.eigenlayer.xyz/t/enhancement-of-pooled-security-mechanisms-in-eigenlayer-blockchain/12202,https://forum.eigenlayer.xyz/u/nnsw3,2023-11-01,Enhancement of Pooled Security Mechanisms in EigenLayer Blockchain
https://forum.eigenlayer.xyz/t/11-lagrange-cross-chain-state-committees/10280,https://forum.eigenlayer.xyz/u/sunali,2023-08-01,11. Lagrange Cross-Chain State Committees
https://forum.eigenlayer.xyz/t/slashing-mechanism/3442,https://forum.eigenlayer.xyz/u/sam.omw1,2023-08-01,Slashing mechanism
