Link,Author,Release Date,Title
https://ethresear.ch/t/managed-cloud-storage/10282,https://ethresear.ch/u/mgraczyk,2023-09-01,Managed Cloud Storage
https://ethresear.ch/t/an-appchain-based-approach-to-eth-rollups-with-ethlets/16512,https://ethresear.ch/u/jinghiskwon,2023-09-01,An appchain-based approach to Eth Rollups with Ethlets
https://ethresear.ch/t/lvr-minimization-in-uniswap-v4/15900,https://ethresear.ch/u/the-ctra1n,2023-08-01,LVR-minimization in Uniswap V4
https://ethresear.ch/t/passkey-based-account-abstraction-signer-for-smart-contract-wallets/15856,https://ethresear.ch/u/rishotics,2023-08-01,Passkey based Account Abstraction signer for smart contract wallets
https://ethresear.ch/t/implementation-overview-of-partial-state-caching-mechanism/16483,https://ethresear.ch/u/sogolmalek,2023-08-01,Implementation overview Of partial state caching mechanism:
https://ethresear.ch/t/bid-cancellations-considered-harmful/15500,https://ethresear.ch/u/mikeneuder,2023-08-01,Bid cancellations considered harmful
https://ethresear.ch/t/better-history-access-by-contracts/2066,https://ethresear.ch/u/fahree,2023-08-01,Better history access by contracts
https://ethresear.ch/t/jolt-and-lasso-a-new-approach-to-building-zkvms/16448,https://ethresear.ch/u/jeroenvdgraaf,2023-08-01,Jolt and Lasso: A New Approach to Building zkVMs
https://ethresear.ch/t/onchain-reputation/16411,https://ethresear.ch/u/paven86,2023-08-01,Onchain Reputation
https://ethresear.ch/t/the-second-slot-itch-statistical-analysis-of-reorgs/16333,https://ethresear.ch/u/nerolation,2023-08-01,The Second-Slot Itch - Statistical Analysis of Reorgs
https://ethresear.ch/t/private-proof-of-burn-ppob-call-free-smart-contract-interactions/16403,https://ethresear.ch/u/keyvank,2023-08-01,Private Proof of Burn (PPoB) + Call-free Smart-Contract interactions
https://ethresear.ch/t/cross-chain-unified-smart-contract-account-without-preset-keystore/16199,https://ethresear.ch/u/leo,2023-08-01,Cross-Chain Unified Smart Contract Account without Preset Keystore
https://ethresear.ch/t/rustic-programming-language-that-targets-the-ethereum-virtual-machine/16292,https://ethresear.ch/u/clearloop,2023-08-01,Rustic programming language that targets the Ethereum Virtual Machine
https://ethresear.ch/t/zkmips-what-security-means-for-our-zkvm-s-proofs-part-2/16384,https://ethresear.ch/u/jeroenvdgraaf,2023-08-01,zkMIPS: What “Security” Means for Our zkVM’s Proofs (Part 2)
https://ethresear.ch/t/solidity-function-types-conversion/16324,https://ethresear.ch/u/maniou-t,2023-08-01,Solidity Function Types conversion
https://ethresear.ch/t/zkmips-what-security-means-for-our-zkvm-s-proofs-part-1/16375,https://ethresear.ch/u/jeroenvdgraaf,2023-08-01,zkMIPS: What “Security” Means for Our zkVM’s Proofs (Part 1)
https://ethresear.ch/t/a-literature-review-on-rollups-and-validium/16370,https://ethresear.ch/u/liveduo,2023-08-01,A “literature review” on Rollups and Validium
