Link,Author,Release Date,Title
https://ethresear.ch/t/read-this-before-posting/8,https://ethresear.ch/u/system,2024-01-29,Read this before posting
https://ethresear.ch/t/fractal-scaling-on-ethereum-layer-3-rollups/19022,https://ethresear.ch/u/purpleshadow2000,2024-03-16,Fractal Scaling on Ethereum (Layer 3 Rollups)
https://ethresear.ch/t/minimal-fully-recursive-zkda-rollup-with-sharded-storage/19020,https://ethresear.ch/u/snjax,2024-03-16,Minimal fully recursive zkDA rollup with sharded storage
https://ethresear.ch/t/initial-analysis-of-stake-distribution/19014,https://ethresear.ch/u/julian,2024-03-15,Initial Analysis of Stake Distribution
https://ethresear.ch/t/grim-forker-checks-and-balances-to-amm-protocol-fees/17565,https://ethresear.ch/u/lajarre,2024-03-15,Grim Forker: checks and balances to AMM protocol fees
https://ethresear.ch/t/how-ai-revolutionizes-ethereum-another-view-on-ai-blockchain/19010,https://ethresear.ch/u/mirror,2024-03-15,"How AI Revolutionizes Ethereum, Another View on “AI+Blockchain”"
https://ethresear.ch/t/how-to-hard-fork-to-save-most-users-funds-in-a-quantum-emergency/18901,https://ethresear.ch/u/vbuterin,2024-03-15,How to hard-fork to save most users’ funds in a quantum emergency
https://ethresear.ch/t/why-wait-a-week-fast-finality-optimistic-rollups/18868,https://ethresear.ch/u/mikerah,2024-03-15,Why wait a week? Fast Finality Optimistic Rollups
https://ethresear.ch/t/zk-fraud-proof-with-zk-state-channel/19004,https://ethresear.ch/u/0x1cc,2024-03-14,ZK Fraud Proof with ZK State Channel
https://ethresear.ch/t/on-increasing-the-block-gas-limit/18567,https://ethresear.ch/u/nerolation,2024-03-14,On Increasing the Block Gas Limit
https://ethresear.ch/t/analyzing-eip-7623-increase-calldata-cost/19002,https://ethresear.ch/u/nerolation,2024-03-14,Analyzing EIP-7623: Increase Calldata Cost
https://ethresear.ch/t/plasma-next-plasma-without-online-requirements/18786,https://ethresear.ch/u/leohio,2024-03-14,Plasma Next: Plasma without Online Requirements
https://ethresear.ch/t/steps-to-achieve-atomic-execution-in-rollups/18776,https://ethresear.ch/u/0xtariz,2024-03-14,Steps to Achieve Atomic Execution in Rollups
https://ethresear.ch/t/zero-knowledge-rainbow-bridge-infusing-blockchain-interactions-with-a-prism-of-privacy/18825,https://ethresear.ch/u/cryptskii,2024-03-14,Zero-Knowledge Rainbow Bridge: Infusing Blockchain Interactions with a Prism of Privacy
https://ethresear.ch/t/the-safety-attack-against-pos/15649,https://ethresear.ch/u/mart1i1n,2024-03-13,The Safety Attack against PoS
https://ethresear.ch/t/how-optional-non-kyc-validator-metadata-can-improve-staking-decentralization/17032,https://ethresear.ch/u/comfygummy,2024-03-13,"How (optional, non-KYC) validator metadata can improve staking decentralization"
https://ethresear.ch/t/promoting-ethereum-research-to-facilitate-interdisciplinary-collaboration-and-academic-user-engagement/18918,https://ethresear.ch/u/mirror,2024-03-12,Promoting Ethereum Research to facilitate interdisciplinary collaboration and academic user engagement
https://ethresear.ch/t/lossydas-lossy-incremental-and-diagonal-sampling-for-data-availability/18963,https://ethresear.ch/u/cskiraly,2024-03-12,"LossyDAS: Lossy, Incremental, and Diagonal Sampling for Data Availability"
https://ethresear.ch/t/decentralized-l2-sequencing-w-native-ibc-interoperability/14944,https://ethresear.ch/u/shakeshack,2024-03-11,Decentralized L2 Sequencing w/ Native IBC Interoperability
https://ethresear.ch/t/ai-rollup-replacing-fault-validity-proof-with-ai-oracle-proof/15320,https://ethresear.ch/u/fewwwww,2024-03-11,"AI Rollup, replacing fault/validity proof with AI oracle proof"
https://ethresear.ch/t/the-more-the-less-censored-introducing-committee-enforced-inclusion-sets-comis-on-ethereum/18835,https://ethresear.ch/u/soispoke,2024-03-11,"The more, the less censored: Introducing committee-enforced inclusion sets (COMIS) on Ethereum"
https://ethresear.ch/t/increase-the-max-effective-balance-a-modest-proposal/15801,https://ethresear.ch/u/mikeneuder,2024-03-10,Increase the MAX_EFFECTIVE_BALANCE – a modest proposal
https://ethresear.ch/t/economic-analysis-of-execution-tickets/18894,https://ethresear.ch/u/jonahb27,2024-03-10,Economic Analysis of Execution Tickets
https://ethresear.ch/t/the-risks-of-lrts/18799,https://ethresear.ch/u/mikeneuder,2024-03-08,The risks of LRTs
https://ethresear.ch/t/octopus-contract-and-its-applications/17844,https://ethresear.ch/u/sorasuegami,2024-03-07,Octopus Contract and its Applications
https://ethresear.ch/t/based-preconfirmations/17353,https://ethresear.ch/u/justindrake,2024-03-07,Based preconfirmations
https://ethresear.ch/t/endgame-staking-economics-a-case-for-targeting/18751,https://ethresear.ch/u/casparschwa,2024-03-07,Endgame Staking Economics: A Case for Targeting
https://ethresear.ch/t/wallet-intents-rethinking-swaps/17682,https://ethresear.ch/u/mattstam,2024-03-07,Wallet Intents - Rethinking Swaps
https://ethresear.ch/t/first-and-second-price-auctions-and-improved-transaction-fee-markets/2410,https://ethresear.ch/u/vbuterin,2024-03-07,First and second-price auctions and improved transaction-fee markets
https://ethresear.ch/t/missed-slot-penalties-temperature-check/18713,https://ethresear.ch/u/maxresnick,2024-03-06,Missed Slot Penalties [Temperature Check]
https://ethresear.ch/t/considering-client-diversity-through-the-lens-of-network-performance/18885,https://ethresear.ch/u/umbnat92,2024-03-06,Considering Client Diversity through the lens of Network Performance
https://ethresear.ch/t/permissioned-privacy-pools/13572,https://ethresear.ch/u/ameensol,2024-03-06,Permissioned Privacy Pools
https://ethresear.ch/t/how-to-create-a-custom-bridge-between-two-evm-based-blockcahin/18883,https://ethresear.ch/u/syedmuhamadyasir,2024-03-06,How to create a custom bridge between two EVM-based blockcahin?
https://ethresear.ch/t/blockchain-sharded-storage-web2-costs-and-web3-security-with-shamir-secret-sharing/18881,https://ethresear.ch/u/snjax,2024-03-06,Blockchain Sharded Storage: Web2 Costs and Web3 Security with Shamir Secret Sharing
https://ethresear.ch/t/burnth-wormcash-a-practical-implementation-of-eip-7503-on-ethereum/18875,https://ethresear.ch/u/keyvank,2024-03-05,Burnth/WormCash: A practical implementation of EIP-7503 on Ethereum
https://ethresear.ch/t/shared-sequencer-for-mev-protection-and-profitable-marketplace/15313,https://ethresear.ch/u/0xtariz,2024-03-05,Shared sequencer for MEV protection and profitable marketplace
https://ethresear.ch/t/rfc-contract-led-storage-rent-roadmap/18642,https://ethresear.ch/u/zergity,2024-03-05,[RFC] Contract-Led Storage-Rent Roadmap
https://ethresear.ch/t/formally-verified-optimised-epoch-processing/17359,https://ethresear.ch/u/michaelsproul,2024-03-04,Formally-verified optimised epoch processing
https://ethresear.ch/t/imo-initial-model-offering/18860,https://ethresear.ch/u/fewwwww,2024-03-03,IMO: Initial Model Offering
https://ethresear.ch/t/rfc-fixing-ethereum-ux-with-user-centric-asset-model-erc-versioning/18760,https://ethresear.ch/u/peersky,2024-03-03,RFC: Fixing Ethereum UX with user-centric asset model & ERC versioning
https://ethresear.ch/t/launching-mev-fyi-the-mev-research-chatbot/18796,https://ethresear.ch/u/val,2024-03-03,"Launching mev.fyi, the MEV research chatbot"
https://ethresear.ch/t/on-block-sizes-gas-limits-and-scalability/18444,https://ethresear.ch/u/nerolation,2024-03-03,"On Block Sizes, Gas Limits and Scalability"
https://ethresear.ch/t/contract-deployment-approaches-in-layer-2-solutions/18851,https://ethresear.ch/u/irnb,2024-03-02,Contract Deployment Approaches in Layer-2 Solutions
https://ethresear.ch/t/why-is-there-a-clear-separation-between-builders-and-validators-under-pbs/18845,https://ethresear.ch/u/gutterberg,2024-03-01,Why is there a clear separation between builders and validators under PBS?
https://ethresear.ch/t/faucet-link-directory/12670,https://ethresear.ch/u/desy,2024-03-01,Faucet Link Directory
https://ethresear.ch/t/privacy-nft-marketplace/18689,https://ethresear.ch/u/terry,2024-03-01,Privacy NFT Marketplace
https://ethresear.ch/t/micro-oracles-a-simple-commitment-augmented-funding-mechanism/18479,https://ethresear.ch/u/ajesiroo,2024-02-29,Micro oracles: a simple commitment-augmented funding mechanism
https://ethresear.ch/t/payload-boosts-in-epbs/18769,https://ethresear.ch/u/potuz,2024-02-29,Payload boosts in ePBS
https://ethresear.ch/t/lookup-singularity-via-mmr/18704,https://ethresear.ch/u/hmac512,2024-02-29,Lookup singularity via MMR
https://ethresear.ch/t/trustless-bitcoin-bridge-creation-with-witness-encryption/11953,https://ethresear.ch/u/leohio,2024-02-28,Trustless Bitcoin Bridge Creation with Witness Encryption
https://ethresear.ch/t/properties-of-issuance-level-consensus-incentives-and-variability-across-potential-reward-curves/18448,https://ethresear.ch/u/aelowsson,2024-02-28,Properties of issuance level: consensus incentives and variability across potential reward curves
https://ethresear.ch/t/the-preconfirmation-gateway-unlocking-preconfirmations-from-user-to-preconfer/18812,https://ethresear.ch/u/mteam88,2024-02-27,The Preconfirmation Gateway ~ Unlocking Preconfirmations: From User to Preconfer
https://ethresear.ch/t/inclusion-list-eip-7547-end-to-end-workflow/18810,https://ethresear.ch/u/terence,2024-02-27,Inclusion List (EIP-7547) End to End Workflow
https://ethresear.ch/t/easy-proof-of-equivalence-between-multiple-polynomial-commitment-schemes-to-the-same-data/8188,https://ethresear.ch/u/vbuterin,2024-02-27,Easy proof of equivalence between multiple polynomial commitment schemes to the same data
https://ethresear.ch/t/collusion-resistant-impartial-selection-protocol-crisp/18804,https://ethresear.ch/u/auryn,2024-02-26,Collusion-Resistant Impartial Selection Protocol (CRISP)
https://ethresear.ch/t/concurrent-block-proposers-in-ethereum/18777,https://ethresear.ch/u/mikeneuder,2024-02-26,Concurrent Block Proposers in Ethereum
https://ethresear.ch/t/minimal-anti-collusion-infrastructure/5413,https://ethresear.ch/u/vbuterin,2024-02-26,Minimal anti-collusion infrastructure
https://ethresear.ch/t/cross-layer-communication-trivially-provable-and-efficient-read-access-to-the-parent-chain/15396,https://ethresear.ch/u/brecht,2024-02-24,Cross layer communication: Trivially provable and efficient read access to the parent chain
https://ethresear.ch/t/unbundling-staking-towards-rainbow-staking/18683,https://ethresear.ch/u/barnabe,2024-02-24,Unbundling staking: Towards rainbow staking
https://ethresear.ch/t/quantum-proof-keypairs-with-ecdsa-zk/14901,https://ethresear.ch/u/yush_g,2024-02-23,Quantum Proof Keypairs with ECDSA + ZK
https://ethresear.ch/t/a-draft-design-for-a-multi-rollup-system/16533,https://ethresear.ch/u/liveduo,2024-02-23,A draft design for a multi-rollup system
https://ethresear.ch/t/stateless-validation-in-a-sharded-blockchain/18763,https://ethresear.ch/u/bowenwang1996,2024-02-23,Stateless validation in a sharded blockchain
https://ethresear.ch/t/unconditional-inclusion-lists/18500,https://ethresear.ch/u/mikeneuder,2024-02-23,Unconditional inclusion lists
https://ethresear.ch/t/single-slot-finality/16700,https://ethresear.ch/u/niconiconi,2024-02-23,Single Slot Finality
https://ethresear.ch/t/execution-tickets/17944,https://ethresear.ch/u/mikeneuder,2024-02-22,Execution Tickets
https://ethresear.ch/t/epbs-design-constraints/18728,https://ethresear.ch/u/potuz,2024-02-22,ePBS design constraints
https://ethresear.ch/t/mev-boost-withdrawal-bug/18749,https://ethresear.ch/u/umbnat92,2024-02-21,MEV-Boost Withdrawal bug
https://ethresear.ch/t/unified-endgame-rollup-requirements/18733,https://ethresear.ch/u/perseverance,2024-02-21,Unified Endgame Rollup Requirements
https://ethresear.ch/t/scalability-limitations-of-kademlia-dhts-when-enabling-data-availability-sampling-in-ethereum/18732,https://ethresear.ch/u/leobago,2024-02-20,Scalability limitations of Kademlia DHTs when Enabling Data Availability Sampling in Ethereum
https://ethresear.ch/t/allowing-validators-to-provide-client-information-privately-a-project-by-nethermind-research-and-nethermind-core/18527,https://ethresear.ch/u/jorem321,2024-02-20,Allowing validators to provide client information privately—a project by Nethermind Research and Nethermind Core
https://ethresear.ch/t/opsides-ncrc-a-trustless-native-cross-rollup-communication-protocol/16441,https://ethresear.ch/u/nanfengpo,2024-02-19,Opside’s NCRC: A Trustless Native Cross Rollup Communication Protocol
https://ethresear.ch/t/preparing-withdrawals-for-compromised-validator-or-withdrawal-keys-fao-zilm/10453,https://ethresear.ch/u/tobesvibration,2024-02-18,Preparing withdrawals for compromised validator or withdrawal keys. FAO Zilm
https://ethresear.ch/t/introducing-yu-a-very-suitable-for-l3-independency-application-blockchain-framework/17302,https://ethresear.ch/u/lawliet-chan,2024-02-18,"Introducing Yu, A very suitable for L3, independency application blockchain framework"
https://ethresear.ch/t/reducing-challenge-times-in-rollups/14997,https://ethresear.ch/u/edfelten,2024-02-17,Reducing challenge times in rollups
https://ethresear.ch/t/efficient-onchain-reward-distribution-pooled-payments-dividends/1924,https://ethresear.ch/u/bogdan,2024-02-16,"Efficient Onchain Reward Distribution (pooled payments, dividends)"
https://ethresear.ch/t/paths-to-hardening-pbs/18666,https://ethresear.ch/u/fradamt,2024-02-16,Paths to hardening PBS
https://ethresear.ch/t/oao-onchain-ai-oracle/18675,https://ethresear.ch/u/fewwwww,2024-02-16,OAO: Onchain AI Oracle
https://ethresear.ch/t/opml-is-all-you-need-run-a-13b-ml-model-on-ethereum/17175,https://ethresear.ch/u/0x1cc,2024-02-14,opML is All You Need: Run a 13B ML Model on Ethereum
https://ethresear.ch/t/rfc-eip7503-private-transfers/18664,https://ethresear.ch/u/mikirov,2024-02-14,[RFC] EIP7503 Private transfers
https://ethresear.ch/t/what-are-your-thoughts-on-decentralized-lotteries/13089,https://ethresear.ch/u/petertakahashi,2024-02-14,What are your thoughts on decentralized lotteries?
https://ethresear.ch/t/simple-decentralized-names-with-proof-of-elapsed-time/18663,https://ethresear.ch/u/uptrenda,2024-02-14,Simple decentralized names with proof-of elapsed time?
https://ethresear.ch/t/the-price-is-right-realigning-proposer-builder-incentives-with-predictive-mev-burn/18656,https://ethresear.ch/u/soispoke,2024-02-13,The price is right: Realigning proposer-builder incentives with predictive MEV-burn
https://ethresear.ch/t/space-program-update-launch-ethereum-nodes-into-gso-geosynchronous-orbit/18614,https://ethresear.ch/u/mirror,2024-02-13,[Space Program] [Update] Launch Ethereum nodes into GSO （Geosynchronous orbit ）
https://ethresear.ch/t/zkmpc-publicly-verifiable-spdz-with-constraints-on-secret-inputs/18661,https://ethresear.ch/u/sheagrief,2024-02-13,ZKMPC: Publicly Verifiable SPDZ with Constraints on Secret Inputs
https://ethresear.ch/t/minimal-epbs-beacon-chain-changes/18653,https://ethresear.ch/u/terence,2024-02-12,Minimal ePBS - Beacon Chain Changes
https://ethresear.ch/t/state-lock-auctions-towards-collaborative-block-building/18558,https://ethresear.ch/u/dmarz,2024-02-11,State Lock Auctions: Towards Collaborative Block Building
https://ethresear.ch/t/transaction-submission-on-based-rollups/18631,https://ethresear.ch/u/mteam88,2024-02-11,Transaction Submission on Based Rollups
https://ethresear.ch/t/universal-plasma-and-da-challenges/18629,https://ethresear.ch/u/donnoh,2024-02-09,Universal Plasma and DA challenges
https://ethresear.ch/t/era-archival-files-for-block-and-consensus-data/13526,https://ethresear.ch/u/arnetheduck,2024-02-09,ERA - archival files for block and consensus data
https://ethresear.ch/t/uniswap-v4-hook-lvr-minimization-with-per-block-conversion-vs-futures-contracts/18610,https://ethresear.ch/u/chris0205.eth,2024-02-08,Uniswap V4 hook: LVR-minimization with Per-block conversion vs. Futures contracts
https://ethresear.ch/t/prover-time-comparison-of-gkr-groth16-vs-groth16-for-proving-mimc-hashes/8373,https://ethresear.ch/u/alexandrebelling,2024-02-08,Prover time comparison of GKR+Groth16 vs. Groth16 for proving MiMC hashes
https://ethresear.ch/t/grounded-relay-superpowers-from-relay-coordination/18601,https://ethresear.ch/u/drewvanderwerff,2024-02-07,Grounded Relay: Superpowers from Relay Coordination
https://ethresear.ch/t/eip-4844-fee-market-analysis/15078,https://ethresear.ch/u/dcrapis,2024-02-07,EIP-4844 Fee Market Analysis
https://ethresear.ch/t/cross-rollup-nft-wrapper-and-migration-ideas/10507,https://ethresear.ch/u/vbuterin,2024-02-06,Cross-rollup NFT wrapper and migration ideas
https://ethresear.ch/t/bridging-nfts-across-layers/10799,https://ethresear.ch/u/psinelnikov,2024-02-06,Bridging NFTs across layers
https://ethresear.ch/t/m-of-n-secret-sharing-with-pre-known-shares/10074,https://ethresear.ch/u/vbuterin,2024-02-06,M-of-N secret sharing with pre-known shares
https://ethresear.ch/t/intent-based-bridge-between-l2s-and-ethereum-powered-by-multi-proof-storage-proofs/18563,https://ethresear.ch/u/unbalancedparenthese,2024-02-05,Intent based bridge between L2s and Ethereum powered by multi-proof storage proofs
https://ethresear.ch/t/privacy-preserving-nullifiers-for-proof-of-identity-applications/18551,https://ethresear.ch/u/turboblitz,2024-02-05,Privacy preserving nullifiers for proof of identity applications
https://ethresear.ch/t/elgamal-encryption-decryption-and-rerandomization-with-circom-support/8074,https://ethresear.ch/u/weijiekoh,2024-02-04,"ElGamal encryption, decryption, and rerandomization, with circom support"
https://ethresear.ch/t/single-slot-finality-based-on-discrete-deposits/18199,https://ethresear.ch/u/liveduo,2024-02-04,Single slot finality based on discrete deposits
https://ethresear.ch/t/based-rollups-superpowers-from-l1-sequencing/15016,https://ethresear.ch/u/justindrake,2024-02-02,Based rollups—superpowers from L1 sequencing
https://ethresear.ch/t/booster-rollups-part-2-zk-evm-as-a-zk-coprocessor/17279,https://ethresear.ch/u/brecht,2024-02-02,Booster rollups part 2: ZK-EVM as a ZK coprocessor
https://ethresear.ch/t/empirical-analysis-of-cross-domain-cex-dex-arbitrage-on-ethereum/17620,https://ethresear.ch/u/0xcchan,2024-02-02,Empirical Analysis of Cross Domain CEX <> DEX Arbitrage on Ethereum
https://ethresear.ch/t/asynchronous-timing-agnostic-sharded-blockchain-using-client-side-ordinal-transaction-ordering/17481,https://ethresear.ch/u/cryptskii,2024-02-01,"Asynchronous, Timing-Agnostic, Sharded Blockchain using Client-side Ordinal Transaction Ordering"
https://ethresear.ch/t/booster-rollups-scaling-l1-directly/17125,https://ethresear.ch/u/brecht,2024-02-01,Booster rollups - scaling L1 directly
https://ethresear.ch/t/2fa-zk-rollups-using-sgx/14462,https://ethresear.ch/u/justindrake,2024-01-31,2FA zk-rollups using SGX
https://ethresear.ch/t/zkconvex-a-large-scale-anonymous-electronic-voting-scheme-based-on-zk-snarks/18461,https://ethresear.ch/u/mirror,2024-01-31,zkConvex - A Large-Scale Anonymous Electronic Voting Scheme Based on zk-SNARKs
https://ethresear.ch/t/unified-description-of-schnorr-ecdsa-and-bls-digital-signatures/18504,https://ethresear.ch/u/jtapolcai,2024-01-31,"Unified Description of Schnorr, ECDSA and BLS Digital Signatures"
https://ethresear.ch/t/from-4844-to-danksharding-a-path-to-scaling-ethereum-da/18046,https://ethresear.ch/u/fradamt,2024-01-30,From 4844 to Danksharding: a path to scaling Ethereum DA
https://ethresear.ch/t/execution-consensus-client-bootnodes/14588,https://ethresear.ch/u/pcaversaccio,2024-01-30,Execution & Consensus Client Bootnodes
https://ethresear.ch/t/part2-decentralized-secure-efficient-orbital-station/18392,https://ethresear.ch/u/zerokpunk,2024-01-30,"Part2: Decentralized, Secure, Efficient Orbital Station"
https://ethresear.ch/t/advancing-blockchain-transaction-privacy-and-compliance-insights-into-innovative-engineering-practices/18487,https://ethresear.ch/u/gyllone,2024-01-29,Advancing Blockchain Transaction Privacy and Compliance: Insights into Innovative Engineering Practices
https://ethresear.ch/t/analyzing-missed-slot-through-the-lens-of-relays-a-potential-path-for-relay-incentivization/18257,https://ethresear.ch/u/ballsyalchemist,2024-01-26,Analyzing Missed Slot Through The Lens of Relays – A potential path for relay incentivization
https://ethresear.ch/t/flashbots-frontrunning-the-mev-crisis/8251,https://ethresear.ch/u/thegostep,2024-01-26,Flashbots: Frontrunning the MEV crisis
https://ethresear.ch/t/completely-recursive-snark-circuit-the-savior-of-play-to-earn/18439,https://ethresear.ch/u/mirror,2024-01-26,Completely Recursive SNARK Circuit - The Savior of “Play to Earn”
https://ethresear.ch/t/is-this-desk-lacking-administration/17249,https://ethresear.ch/u/peersky,2024-01-26,Is this desk lacking administration?
https://ethresear.ch/t/privacy-and-regulation-in-our-decentralized-future/17538,https://ethresear.ch/u/jiangxb-son,2024-01-26,Privacy and Regulation in our decentralized future
https://ethresear.ch/t/an-alternative-incentive-mechanism-to-achieve-client-diversity/11986,https://ethresear.ch/u/ammarlakho,2024-01-25,An alternative incentive mechanism to achieve client diversity
https://ethresear.ch/t/testing-path-for-a-gas-limit-increase/18399,https://ethresear.ch/u/parithosh,2024-01-24,Testing path for a gas limit increase
https://ethresear.ch/t/leveraging-an-existing-pki-for-a-trustless-and-privacy-preserving-identity-verification-scheme/15154,https://ethresear.ch/u/pierre,2024-01-23,Leveraging an existing PKI for a trustless and privacy preserving identity verification scheme
https://ethresear.ch/t/sticking-to-8192-signatures-per-slot-post-ssf-how-and-why/17989,https://ethresear.ch/u/vbuterin,2024-01-22,Sticking to 8192 signatures per slot post-SSF: how and why
https://ethresear.ch/t/basic-tokenomics-discussion-at-econ-101-level/18110,https://ethresear.ch/u/noamnisan,2024-01-18,Basic tokenomics discussion at econ-101 level
https://ethresear.ch/t/default-post-quantum-signature-scheme/2665,https://ethresear.ch/u/ericm,2024-01-18,Default post-quantum signature scheme?
https://ethresear.ch/t/benchmarking-zkp-development-frameworks-the-pantheon-of-zkp/14943,https://ethresear.ch/u/modong,2024-01-18,Benchmarking ZKP Development Frameworks: the Pantheon of ZKP
https://ethresear.ch/t/part1-boosting-the-connectivity-of-ethereum-layer2s/18390,https://ethresear.ch/u/zerokpunk,2024-01-18,Part1: Boosting the connectivity of Ethereum Layer2s
https://ethresear.ch/t/a-decentralised-solver-architecture-for-executing-intents-on-evm-blockchain/16608,https://ethresear.ch/u/rishotics,2024-01-16,A decentralised solver architecture for executing intents on EVM blockchain
https://ethresear.ch/t/defining-zkoracle-for-ethereum/15131,https://ethresear.ch/u/fewwwww,2024-01-16,Defining zkOracle for Ethereum
https://ethresear.ch/t/based-rollups-can-reward-proposers-first-come-first-serve/18317,https://ethresear.ch/u/mteam88,2024-01-15,Based Rollups can reward Proposers First Come First Serve
https://ethresear.ch/t/privatizing-the-volume-and-timing-of-ethereum-transactions/16184,https://ethresear.ch/u/trevormil,2024-01-15,Privatizing the Volume and Timing of Ethereum Transactions
https://ethresear.ch/t/zkcasper-a-snark-based-protocol-for-verifying-casper-ffg-consensus/15559,https://ethresear.ch/u/seunlanlege,2024-01-15,zkCasper: A SNARK based protocol for verifying Casper FFG Consensus
https://ethresear.ch/t/private-accounts-module-on-ethereum-without-underlying-protocol-changes/16297,https://ethresear.ch/u/eerkaijun,2024-01-15,Private Accounts Module on Ethereum (Without Underlying Protocol Changes)
https://ethresear.ch/t/stealth-address-in-account-abstraction/16774,https://ethresear.ch/u/jstinhw,2024-01-15,Stealth Address in Account Abstraction
https://ethresear.ch/t/cicada-private-on-chain-voting-from-homomorphic-time-lock-puzzles/15748,https://ethresear.ch/u/moodlezoup,2024-01-15,Cicada: private on-chain voting from homomorphic time-lock puzzles
https://ethresear.ch/t/anti-mixer-privacy-protocol/16687,https://ethresear.ch/u/snjax,2024-01-15,Anti-mixer privacy protocol
https://ethresear.ch/t/compliant-sanction-for-tornado-cash/18326,https://ethresear.ch/u/jstinhw,2024-01-15,Compliant Sanction for Tornado Cash
https://ethresear.ch/t/the-language-design-that-on-evm-v-s-that-on-others/9548,https://ethresear.ch/u/ghasshee,2024-01-14,"The language design, that on EVM v.s. that on Others"
https://ethresear.ch/t/proper-disk-i-o-gas-pricing-via-lru-cache/18146,https://ethresear.ch/u/phabc,2024-01-14,Proper disk i/o gas pricing via LRU cache
https://ethresear.ch/t/validator-timing-game-post-eip4844/18129,https://ethresear.ch/u/terence,2024-01-13,Validator Timing Game Post EIP4844
https://ethresear.ch/t/proving-a-chain-of-hashes-using-plonky2/15246,https://ethresear.ch/u/garvitgoel,2024-01-13,Proving a Chain of Hashes using plonky2
https://ethresear.ch/t/negative-price-amm/17833,https://ethresear.ch/u/v-for-vasya,2024-01-12,Negative Price AMM
https://ethresear.ch/t/peerdas-a-simpler-das-approach-using-battle-tested-p2p-components/16541,https://ethresear.ch/u/djrtwo,2024-01-10,PeerDAS – a simpler DAS approach using battle-tested p2p components
https://ethresear.ch/t/a-totally-innovative-idea-to-solve-privacy-issue-let-us-discuss-the-feasibility-of-this-plan/13742,https://ethresear.ch/u/vitalikfans,2024-01-10,A totally innovative idea to solve privacy issue.Let us discuss the feasibility of this plan
https://ethresear.ch/t/signature-merging-for-large-scale-consensus/17386,https://ethresear.ch/u/asn,2024-01-10,Signature Merging for Large-Scale Consensus
https://ethresear.ch/t/trust-minimised-dns-oracle-based-on-zk-tls-verification/18183,https://ethresear.ch/u/alexhook,2024-01-10,Trust-minimised DNS oracle based on ZK TLS verification
https://ethresear.ch/t/social-forking-options/18248,https://ethresear.ch/u/themandalore,2024-01-09,Social Forking Options
