Link,Author,Release Date,Title
https://collective.flashbots.net/t/about-the-relays-category/125,https://collective.flashbots.net/u/guayabyte,2022-12-01,About the Relays category
https://collective.flashbots.net/t/is-the-flashbots-builder-repository-used-for-eth-staking-relayers-or-something-else/3372,https://collective.flashbots.net/u/adamhurwitz.eth,2024-04-30,Is the Flashbots “builder” repository used for ETH staking relayers or something else?
https://collective.flashbots.net/t/mb-direct-an-idea-for-mev-boost-improvement/3350,https://collective.flashbots.net/u/quintus,2024-04-25,MB-Direct: An idea for MEV-Boost improvement
https://collective.flashbots.net/t/sepolia-relay-doesnt-produce-blocks/3349,https://collective.flashbots.net/u/loban,2024-04-23,Sepolia relay doesnt produce blocks
https://collective.flashbots.net/t/does-flashbots-relay-accept-blocks-from-external-builders-without-a-paid-plan/3294,https://collective.flashbots.net/u/kosala,2024-04-11,Does Flashbots Relay accept blocks from external builders without a paid plan?
https://collective.flashbots.net/t/http-status-400-invalid-signature/3220,https://collective.flashbots.net/u/mcryptid,2024-03-23,HTTP Status 400: Invalid Signature
https://collective.flashbots.net/t/cannot-see-ofac-filter-implemented-within-the-source-code/3153,https://collective.flashbots.net/u/kosala,2024-03-06,Cannot see OFAC filter implemented within the source code
https://collective.flashbots.net/t/why-boost-relay-source-code-in-github-does-not-support-holesky/3145,https://collective.flashbots.net/u/kosala,2024-03-05,Why boost Relay source code in Github does not support holesky?
https://collective.flashbots.net/t/block-scoring-for-mev-boost-relays/202,https://collective.flashbots.net/u/thegostep,2024-02-22,Block scoring for mev-boost relays
https://collective.flashbots.net/t/how-to-test-validator-registrations-in-a-testnet/2864,https://collective.flashbots.net/u/kosala,2024-01-04,How to test validator registrations in a testnet?
https://collective.flashbots.net/t/where-do-you-get-a-list-of-builders-addresses/443,https://collective.flashbots.net/u/metachris,2024-01-04,Where do you get a list of builders addresses?
https://collective.flashbots.net/t/error-when-trying-to-start-the-housekeeper-within-the-relay/2796,https://collective.flashbots.net/u/kosala,2023-12-01,Error when trying to start the housekeeper within the Relay
https://collective.flashbots.net/t/ideas-for-incentivizing-relays/586,https://collective.flashbots.net/u/dmarz,2023-10-01,Ideas for Incentivizing Relays
https://collective.flashbots.net/t/how-to-prevent-mev-stealing-by-proposer/2473,https://collective.flashbots.net/u/ywzx,2023-09-01,How to prevent MEV stealing by Proposer?
https://collective.flashbots.net/t/relayer-submission-acknowledged-but-not-recieved/2249,https://collective.flashbots.net/u/dotokk,2023-08-01,Relayer Submission acknowledged but not recieved
https://collective.flashbots.net/t/about-relay-url/2236,https://collective.flashbots.net/u/dongri,2023-08-01,About relay-url
https://collective.flashbots.net/t/towards-trustless-optimistic-relaying/1761,https://collective.flashbots.net/u/sfyll,2023-05-01,Towards Trustless Optimistic Relaying
https://collective.flashbots.net/t/monitoring-validator-registration-for-fee-recipients/1719,https://collective.flashbots.net/u/0xsmoothly,2023-05-01,Monitoring Validator_Registration for Fee Recipients
https://collective.flashbots.net/t/bookmarks-relevant-for-relays/401,https://collective.flashbots.net/u/guayabyte,2023-04-01,Bookmarks relevant for relays
https://collective.flashbots.net/t/optimistic-relaying-on-ultra-sound-relay/1486,https://collective.flashbots.net/u/mikeneuder.eth,2023-03-01,Optimistic relaying on ultra sound relay
https://collective.flashbots.net/t/the-flashbots-builder-is-now-sending-to-external-relays/898,https://collective.flashbots.net/u/angelfish,2023-03-01,The Flashbots Builder is now sending to external relays
https://collective.flashbots.net/t/getting-cors-error-in-sendrawtransaction-function-from-reactjs-localhost/1347,https://collective.flashbots.net/u/jatinder,2023-02-01,Getting cors error in sendRawTransaction function from reactjs localhost
https://collective.flashbots.net/t/not-connected-to-ethereum-network-error/1184,https://collective.flashbots.net/u/dours,2023-02-01,“Not connected to Ethereum network” error
https://collective.flashbots.net/t/secure-rpc-v2-relay-now-on-goerli/1220,https://collective.flashbots.net/u/sambacha,2023-02-01,Secure RPC v2 Relay now on goerli
https://collective.flashbots.net/t/relayscan-io-bulk-data-download/1208,https://collective.flashbots.net/u/metachris,2023-02-01,Relayscan.io bulk data download
https://collective.flashbots.net/t/mev-relay-monitor-dashboard/766,https://collective.flashbots.net/u/slal12,2022-12-01,MEV Relay Monitor Dashboard
https://collective.flashbots.net/t/standardize-relay-start-slot-on-relay-homepages/934,https://collective.flashbots.net/u/nerolation,2022-12-01,Standardize relay start slot on relay homepages
https://collective.flashbots.net/t/aestus-a-neutral-relay/786,https://collective.flashbots.net/u/austonst,2022-12-01,Aestus: A Neutral Relay
https://collective.flashbots.net/t/relay-specs-on-github/594,https://collective.flashbots.net/u/jtraglia,2022-12-01,Relay Specs on GitHub
https://collective.flashbots.net/t/which-relays-should-we-send-our-blocks-to/774,https://collective.flashbots.net/u/bert,2022-11-01,Which relays should we send our blocks to?
https://collective.flashbots.net/t/announcing-mev-boost-relay-v0-11-0-notable-feature-block-submission-cancellations/604,https://collective.flashbots.net/u/metachris,2022-11-01,Announcing mev-boost-relay v0.11.0 - notable feature: block submission cancellations
https://collective.flashbots.net/t/post-mortem-for-a-relay-vulnerability-leading-to-proposers-falling-back-to-local-block-production-nov-10-2022/727,https://collective.flashbots.net/u/metachris,2022-11-01,"Post-mortem for a relay vulnerability leading to proposers falling back to local block production (Nov. 10, 2022)"
https://collective.flashbots.net/t/privacy-concerns-with-data-api/568,https://collective.flashbots.net/u/jtraglia,2022-11-01,Privacy Concerns with Data API
https://collective.flashbots.net/t/what-makes-a-relay-trust-worthy/145,https://collective.flashbots.net/u/guayabyte,2022-11-01,What makes a relay trust-worthy?
https://collective.flashbots.net/t/flashbots-relay-data-api-update-no-limit-on-entries-when-querying-builder-submissions-by-slot/707,https://collective.flashbots.net/u/metachris,2022-11-01,Flashbots Relay Data API update: no limit on entries when querying builder submissions by slot
https://collective.flashbots.net/t/flashbots-relay-bulk-data-exports-payloads-and-builder-submissions/700,https://collective.flashbots.net/u/metachris,2022-11-01,Flashbots relay bulk data exports: payloads and builder submissions
https://collective.flashbots.net/t/mev-boost-relay-connect-to-avalanche/625,https://collective.flashbots.net/u/daviddiscua,2022-10-01,MEV-boost-relay connect to Avalanche
https://collective.flashbots.net/t/discussion-regarding-validator-specified-censorship/615,https://collective.flashbots.net/u/benjamin-bloxroute,2022-10-01,Discussion regarding validator specified censorship
https://collective.flashbots.net/t/upcoming-relay-data-api-update-adding-timestamp-ms-to-builder-blocks-received/610,https://collective.flashbots.net/u/metachris,2022-10-01,Upcoming relay data API update: adding `timestamp_ms` to `builder_blocks_received`
https://collective.flashbots.net/t/request-a-full-block-censoring-flashbots-relay-for-censorship-sensitive-proposers/593,https://collective.flashbots.net/u/arbora,2022-10-01,Request: A Full-Block-Censoring FlashBots Relay For Censorship-Sensitive Proposers
https://collective.flashbots.net/t/upcoming-relay-feature-allowing-builders-to-cancel-previous-block-submissions/600,https://collective.flashbots.net/u/metachris,2022-10-01,Upcoming relay feature: allowing builders to cancel previous block submissions
https://collective.flashbots.net/t/relays-data-api-include-block-number-and-num-tx/527,https://collective.flashbots.net/u/metachris,2022-10-01,Relays Data API: include `block_number` and `num_tx`
https://collective.flashbots.net/t/public-list-of-builders-connected-to-flashbots-relay/407,https://collective.flashbots.net/u/ben,2022-09-01,Public list of builders connected to Flashbots Relay?
https://collective.flashbots.net/t/bookmarks-relevant-for-proposers/400,https://collective.flashbots.net/u/guayabyte,2022-08-01,Bookmarks relevant for proposers
