Link,Author,Release Date,Title
https://research.lido.fi/t/welcome-to-lido-dao/7,https://research.lido.fi/u/system,2024-05-19,Welcome to Lido DAO
https://research.lido.fi/t/mellow-lido-alliance-proposal/7557,https://research.lido.fi/u/s0xn1ck,2024-06-03,Mellow Lido Alliance proposal
https://research.lido.fi/t/lido-alliance-an-ethereum-aligned-ecosystem/7475,https://research.lido.fi/u/steakhouse,2024-06-03,Lido Alliance: An Ethereum-Aligned Ecosystem
https://research.lido.fi/t/seednode-lido/6641,https://research.lido.fi/u/seedlatam,2024-06-03,SEEDNode - Lido
https://research.lido.fi/t/proposal-expanding-the-simple-dvt-module/7549,https://research.lido.fi/u/kimonsh,2024-05-31,Proposal: Expanding the Simple DVT Module
https://research.lido.fi/t/lido-1-november-1-2022-april-30-2023-lido-ongoing-funding-request/3133,https://research.lido.fi/u/steakhouse,2024-05-31,"[LIDO-1] November 1, 2022 - April 30, 2023 | Lido Ongoing Funding Request"
https://research.lido.fi/t/xga-extensible-gas-auctions-for-enabling-preconfirmations-without-restaking-or-epbs/7584,https://research.lido.fi/u/sambacha,2024-05-31,XGA: eXtensible Gas Auctions for enabling Preconfirmations without Restaking or ePBS
https://research.lido.fi/t/ethereum-node-operator-el-diversity-improvement-commitments/6459,https://research.lido.fi/u/izzy,2024-05-31,Ethereum Node Operator EL Diversity Improvement Commitments
https://research.lido.fi/t/notice-of-motion-for-entry-of-default-against-lido-dao-or-in-the-alternative-for-alternative-service-on-lido-dao/7608,https://research.lido.fi/u/fairmarkpartners,2024-05-30,"Notice of Motion for Entry of Default Against Lido DAO, or in the Alternative, for Alternative Service On Lido DAO"
https://research.lido.fi/t/proposal-onboard-drop-to-the-lido-alliance/7556,https://research.lido.fi/u/d_argunov,2024-05-30,Proposal: Onboard Drop to the Lido Alliance
https://research.lido.fi/t/lip-23-negative-rebase-sanity-check-with-second-opinion/7543,https://research.lido.fi/u/greg_s,2024-05-30,LIP-23: Negative rebase sanity check with second opinion
https://research.lido.fi/t/dual-governance-design-and-implementation-proposal/7131,https://research.lido.fi/u/kadmil,2024-05-30,Dual Governance: design and implementation proposal
https://research.lido.fi/t/egg-establishing-the-community-lifeguards-initiative-cli-sub-committee/7527,https://research.lido.fi/u/enti,2024-05-30,[EGG] Establishing the Community Lifeguards Initiative (CLI) Sub-Committee
https://research.lido.fi/t/ldo-steth-dual-governance-continuation/5727,https://research.lido.fi/u/skozin,2024-05-30,LDO+stETH dual governance (continuation)
https://research.lido.fi/t/lego-grants-stake-unstake-eth-on-lido-with-a-prompt-and-the-creation-of-a-lido-kb/7218,https://research.lido.fi/u/brianknowsai,2024-05-29,LEGO Grants - Stake/Unstake ETH on LIDO with a prompt and the creation of a LIDO kb
https://research.lido.fi/t/grant-proposal-integrating-nethermind-sedge-with-lido-csm/6629,https://research.lido.fi/u/zerocloo,2024-05-29,Grant Proposal - Integrating Nethermind Sedge with Lido CSM
https://research.lido.fi/t/wormhole-x-axelar-lido-bridge-implementation-for-wsteth-on-bnb-chain/6012,https://research.lido.fi/u/wormhole-axelar,2024-05-29,Wormhole x Axelar | Lido Bridge: Implementation for wstETH on BNB Chain
https://research.lido.fi/t/dappnode-proposal-for-csm-and-sdvtm-integration/6739,https://research.lido.fi/u/lanski,2024-05-29,Dappnode Proposal for CSM and SDVTM integration
https://research.lido.fi/t/stereum-csm-simpledvt-integration-grant-proposal/6502,https://research.lido.fi/u/stefa2k,2024-05-29,Stereum CSM & SimpleDVT Integration Grant Proposal
https://research.lido.fi/t/alliance-review-and-security-checklist/7578,https://research.lido.fi/u/steakhouse,2024-05-27,Alliance Review and Security Checklist
https://research.lido.fi/t/failed-to-fetch-error-message/630,https://research.lido.fi/u/therecycledpirate,2024-05-27,Failed to fetch error message
https://research.lido.fi/t/liquify-proposal-for-csm-and-sdvtm-integration/6767,https://research.lido.fi/u/romanc,2024-05-27,Liquify Proposal for CSM and SDVTM integration
https://research.lido.fi/t/blockops-network-proposal-for-csm-and-sdvtm-integration/6754,https://research.lido.fi/u/haroldsphinx,2024-05-27,Blockops Network Proposal for CSM and SDVTM Integration
https://research.lido.fi/t/curve-proposal-continue-ldo-reward-initiative-with-3-750-000-ldo-0-375/602,https://research.lido.fi/u/kethfinex,2024-05-26,"Curve Proposal: Continue LDO Reward Initiative With 3,750,000 LDO (0.375%)"
https://research.lido.fi/t/lido-on-ethereum-node-operator-numic-security-incident-disclosure-may-21-2024/7536,https://research.lido.fi/u/izzy,2024-05-26,"Lido on Ethereum Node Operator (Numic) Security Incident Disclosure - May 21, 2024"
https://research.lido.fi/t/ebunker-proposal-for-lido-csm-integration/6763,https://research.lido.fi/u/allen_ebunker,2024-05-26,Ebunker Proposal for LIDO CSM integration
https://research.lido.fi/t/building-a-lido-dao-community-of-users-and-developers-in-ghana/4480,https://research.lido.fi/u/ahbyan,2024-05-25,Building a lido dao community of users and developers in ghana
https://research.lido.fi/t/regoose-updated-goals-for-lido-in-the-light-of-mvi-and-restaking/7462,https://research.lido.fi/u/hasu,2024-05-25,ReGOOSE: Updated goals for Lido in the light of MVI and restaking
https://research.lido.fi/t/staking-router-module-proposal-simple-dvt/5625,https://research.lido.fi/u/kimonsh,2024-05-24,Staking Router Module Proposal: Simple DVT
https://research.lido.fi/t/crisis-situation-answers-you-can-trust/7531,https://research.lido.fi/u/tina_bate,2024-05-21,Crisis situation answers you can trust
https://research.lido.fi/t/wsteth-deployment-on-mode/7365,https://research.lido.fi/u/adamthewhale,2024-05-20,wstETH Deployment on Mode
https://research.lido.fi/t/stablelab-delegate-thread-updated/4904,https://research.lido.fi/u/stable_lab,2024-05-17,StableLab Delegate Thread - Updated
https://research.lido.fi/t/rocklogic-monthly-notes-05-2024/7495,https://research.lido.fi/u/vithya,2024-05-15,RockLogic Monthly Notes - 05/2024
https://research.lido.fi/t/network-expansion-workgroup-initiative-governance-decision-forwarding-to-non-l2-networks-lip-24/7446,https://research.lido.fi/u/thedzhon,2024-05-14,Network Expansion Workgroup initiative: governance decision forwarding to non-L2 networks (LIP-24)
https://research.lido.fi/t/grant-proposal-lido-spanish-videos-and-translations/6296,https://research.lido.fi/u/dmars300,2024-05-13,Grant proposal: Lido Spanish videos and translations
https://research.lido.fi/t/proposal-for-lido-staking-eth-rewards-for-ldo-stakers/7123,https://research.lido.fi/u/dexterislucas,2024-05-09,Proposal for Lido Staking: $ETH Rewards for $LDO Stakers
https://research.lido.fi/t/launchnodes-africa-infrastructure-update/7441,https://research.lido.fi/u/rajesh,2024-05-08,Launchnodes: Africa Infrastructure Update
https://research.lido.fi/t/slashing-incident-involving-launchnodes-validators-oct-11-2023/5631,https://research.lido.fi/u/izzy,2024-05-07,"Slashing Incident involving Launchnodes Validators - Oct 11, 2023"
https://research.lido.fi/t/lido-community-lifeguards-initiative/4678,https://research.lido.fi/u/alex_l,2024-05-07,Lido Community Lifeguards Initiative
https://research.lido.fi/t/lido-on-ethereum-call-for-relay-providers/2844,https://research.lido.fi/u/kimonsh,2024-05-06,Lido on Ethereum: Call for Relay Providers
https://research.lido.fi/t/lip-21-simple-on-chain-delegation/6840,https://research.lido.fi/u/zuzu_eeka,2024-05-05,LIP-21: Simple On-chain Delegation
https://research.lido.fi/t/where-is-my-reward/7412,https://research.lido.fi/u/one166166,2024-05-04,Where is my reward？
https://research.lido.fi/t/how-do-i-get-steth/7390,https://research.lido.fi/u/migiya,2024-05-03,How do i get stETH
https://research.lido.fi/t/community-staking-module/5917,https://research.lido.fi/u/dgusakov,2024-05-03,Community Staking Module
https://research.lido.fi/t/where-is-my-eth-when-my-withdraw-tx-failed-i-cannot-found-my-eth-or-steth/7167,https://research.lido.fi/u/guotie,2024-05-02,"Where is my ETH? when my withdraw tx failed, I cannot found my ETH or stETH"
https://research.lido.fi/t/proposal-the-l1do-blockchain/6369,https://research.lido.fi/u/abeltesfaye2023,2024-05-01,Proposal: The L1do Blockchain
https://research.lido.fi/t/lego-q1-2024-report/7364,https://research.lido.fi/u/alex_l,2024-04-30,LEGO Q1 2024 Report
https://research.lido.fi/t/what-type-of-onchain-data-does-lido-look-at-and-use/7360,https://research.lido.fi/u/shreekar_puranik,2024-04-30,What type of onchain data does Lido look at and use
https://research.lido.fi/t/request-to-help-with-freeze-steth-held-by-zkasino-exit-scam-wallet-30m-10-000-victims/7208,https://research.lido.fi/u/dkc,2024-04-27,"Request to help with/freeze $stETH held by Zkasino Exit Scam wallet ($30m - 10,000 victims)"
https://research.lido.fi/t/renew-gateseal-for-the-withdrawal-queue-and-validator-exit-bus-oracle/7081,https://research.lido.fi/u/zuzu_eeka,2024-04-26,Renew GateSeal for the Withdrawal Queue and Validator Exit Bus Oracle
https://research.lido.fi/t/urgent-scam-involving-lidos-smart-contract-request-for-community-and-lido-finance-team-suppor/6145,https://research.lido.fi/u/cantinflas,2024-04-25,Urgent: Scam involving Lido’s smart contract - Request for Community and Lido Finance Team Suppor
https://research.lido.fi/t/tmc-1-pipeline-to-sell-steth-at-regular-intervals-for-dai/5059,https://research.lido.fi/u/steakhouse,2024-04-25,TMC-1: Pipeline to sell stETH at regular intervals for DAI
https://research.lido.fi/t/lido-v2-gateseal-committee/4561,https://research.lido.fi/u/kadmil,2024-04-23,Lido V2 GateSeal Committee
https://research.lido.fi/t/hasus-goose-submission-proposed-goals-for-lido-dao-to-consider/5590,https://research.lido.fi/u/hasu,2024-04-23,[Hasu’s GOOSE Submission] Proposed goals for Lido DAO to consider
https://research.lido.fi/t/lido-on-ethereum-node-operator-infstones-platform-vulnerability-investigation-november-22-2023/6001,https://research.lido.fi/u/izzy,2024-04-22,"Lido on Ethereum Node Operator (InfStones) Platform Vulnerability Investigation - November 22, 2023"
https://research.lido.fi/t/request-for-proposal-csm-and-sdvtm-integration/6225,https://research.lido.fi/u/aleksandra_g,2024-04-22,Request for Proposal | CSM and SDVTM integration
https://research.lido.fi/t/staking-decentralization-study/6630,https://research.lido.fi/u/leobago,2024-04-22,Staking Decentralization Study
https://research.lido.fi/t/lido-dual-governance-explainer-research-distillation/7132,https://research.lido.fi/u/sacha,2024-04-20,Lido dual governance explainer (research distillation)
https://research.lido.fi/t/funds-stolen-from-ledger-wallet-through-nft-scam-can-we-vote-on-the-dao-to-freeze-account-reallocate/7077,https://research.lido.fi/u/akz,2024-04-16,Funds stolen from Ledger wallet through NFT scam… Can we vote on the DAO to freeze account/reallocate?
https://research.lido.fi/t/d-u-c-k-distributed-utilization-of-configurations-and-knowledge-proposal/5848,https://research.lido.fi/u/julianu,2024-04-15,D.U.C.K. - Distributed Utilization of Configurations and Knowledge Proposal
https://research.lido.fi/t/fork-to-return-scammed-funds-millions/7158,https://research.lido.fi/u/akz,2024-04-15,Fork to return scammed funds (Millions)
https://research.lido.fi/t/i-39-m-a-newbie-and-i-don-39-t-understand-some-questions-please-give-me-some-advice/7142,https://research.lido.fi/u/huxiansheng123,2024-04-15,I&#39;m a newbie and I don&#39;t understand some questions. Please give me some advice
https://research.lido.fi/t/rocklogic-monthly-notes-04-2024/7137,https://research.lido.fi/u/vithya,2024-04-13,RockLogic Monthly Notes - 04/2024
https://research.lido.fi/t/temperature-check-wsteth-deployment-to-lisk-and-ownership-acceptance-by-lido-dao/6669,https://research.lido.fi/u/lisk,2024-04-12,Temperature Check | wstETH Deployment to Lisk and Ownership Acceptance by Lido DAO
https://research.lido.fi/t/holesky-safe-q2-2024-budget-provision-support-maintenance/7089,https://research.lido.fi/u/eduardo_protofire,2024-04-11,Holesky Safe - Q2/2024 Budget Provision - Support & Maintenance
https://research.lido.fi/t/proposal-create-a-centralized-exchange-liquidity-dashboard-for-eth-and-steth-develop-a-strategy-to-improve-steth-liquidity/5162,https://research.lido.fi/u/glass_markets,2024-04-10,[Proposal] Create A Centralized Exchange Liquidity Dashboard for $ETH and $STETH & Develop A Strategy to Improve $STETH Liquidity
https://research.lido.fi/t/activate-lido-protocol-governance-with-revenue-share-staking/6738,https://research.lido.fi/u/lidosaviour,2024-04-08,Activate Lido Protocol Governance with Revenue Share Staking
https://research.lido.fi/t/profit-displayed/7057,https://research.lido.fi/u/vanba,2024-04-02,% profit displayed
https://research.lido.fi/t/community-staking-fleet-pilot/6606,https://research.lido.fi/u/enti,2024-04-02,Community Staking Fleet Pilot
https://research.lido.fi/t/why-is-there-no-interest-in-the-ldo-token-serious-question/6141,https://research.lido.fi/u/abeltesfaye2023,2024-04-01,"Why is there no interest in the LDO token, serious question"
https://research.lido.fi/t/why-not-bring-back-stsol-p2p-is-still-doing-it/6395,https://research.lido.fi/u/abeltesfaye2023,2024-04-01,Why not bring back stSOL? p2p is still doing it
https://research.lido.fi/t/proposal-introducing-ldo-staking/4636,https://research.lido.fi/u/lidomaxi,2024-04-01,Proposal: Introducing $LDO Staking
https://research.lido.fi/t/staking-router-distribution-mechanisms-research/6330,https://research.lido.fi/u/felixlts,2024-03-29,Staking Router Distribution Mechanisms Research
https://research.lido.fi/t/ebunker-proposal-for-lido-sdvtm-integration/6764,https://research.lido.fi/u/allen_ebunker,2024-03-28,Ebunker Proposal for LIDO SDVTM integration
https://research.lido.fi/t/tiered-rewards-share-program-a-sustainable-approach-to-steth-growth/4851,https://research.lido.fi/u/frontalpha,2024-03-28,Tiered Rewards Share Program: A Sustainable Approach to stETH Growth
https://research.lido.fi/t/lido-to-join-proof-of-stake-alliance/3142,https://research.lido.fi/u/alex_l,2024-03-27,Lido to join Proof Of Stake Alliance
https://research.lido.fi/t/guardians-is-very-important/7008,https://research.lido.fi/u/lawrence,2024-03-27,Guardians is very important
https://research.lido.fi/t/liquidity-observation-lab-lol-liquidity-strategy-and-application-to-curve-steth-eth-pool/5335,https://research.lido.fi/u/steakhouse,2024-03-26,Liquidity Observation Lab (LOL): Liquidity Strategy and application to Curve stETH:ETH Pool
https://research.lido.fi/t/lido-in-morocco-2024-proposal/6928,https://research.lido.fi/u/moneky_d.luffy,2024-03-24,Lido in Morocco 2024 (Proposal)
https://research.lido.fi/t/lido-stonks-treasury-swaps-via-optimistic-governance/6860,https://research.lido.fi/u/alex_l,2024-03-22,Lido Stonks: Treasury Swaps via Optimistic Governance
https://research.lido.fi/t/ecosystem-summaries-to-help-the-community-stay-up-to-date/6842,https://research.lido.fi/u/daveytea,2024-03-22,Ecosystem summaries to help the community stay up to date
https://research.lido.fi/t/wsteth-deployment-on-scroll/6603,https://research.lido.fi/u/sherooberoo,2024-03-22,wstETH Deployment on Scroll
https://research.lido.fi/t/rewards-share-program-2024/6812,https://research.lido.fi/u/smiles,2024-03-22,Rewards-Share Program 2024
https://research.lido.fi/t/its-the-tokenomics-stupid/2348,https://research.lido.fi/u/chuck,2024-03-19,"It’s the tokenomics, stupid!"
https://research.lido.fi/t/user-research-into-1k-ldo-token-holders/6877,https://research.lido.fi/u/henry,2024-03-19,User research into 1k+ LDO token holders
https://research.lido.fi/t/loss-of-coins-be-careful/6950,https://research.lido.fi/u/nick,2024-03-18,"Loss of coins, be careful"
https://research.lido.fi/t/question-regarding-staking-esp-in-lido/6940,https://research.lido.fi/u/yasir,2024-03-18,"Question regarding staking, esp in Lido"
https://research.lido.fi/t/unstaking-steth-with-ledger-wallet/6863,https://research.lido.fi/u/edward_leetham,2024-03-15,Unstaking stETH with Ledger wallet
https://research.lido.fi/t/tmc-2-research-and-implement-permissionless-stonks-execution/6861,https://research.lido.fi/u/steakhouse,2024-03-15,TMC-2: Research and implement permissionless Stonks execution
https://research.lido.fi/t/steth-token-integration-to-all-electrocoin-s-platforms/6391,https://research.lido.fi/u/electrocoin,2024-03-15,stETH token integration to all Electrocoin’s platforms
