Link,Author,Release Date,Title
https://forum.makerdao.com/t/about-the-ecosystem-proposals-category/20691,https://forum.makerdao.com/u/prose11,2024-01-08,About the Ecosystem Proposals category
https://forum.makerdao.com/t/solution-to-improve-dao-governance-efficiency/23162,https://forum.makerdao.com/u/como,2024-02-19,Solution to Improve DAO Governance Efficiency
https://forum.makerdao.com/t/proposal-for-the-introduction-of-wrapped-privacy-enhanced-dai-wpdai/23192,https://forum.makerdao.com/u/tggeth,2023-12-01,Proposal for the Introduction of wrapped privacy enhanced DAI (wpDAI)
https://forum.makerdao.com/t/proposal-docit-discord-bot-for-maker-dao-documentation-and-support/21942,https://forum.makerdao.com/u/docit,2023-09-01,[Proposal] DOCit - Discord Bot for Maker DAO Documentation and Support
https://forum.makerdao.com/t/maker-arranger-proposal-matterhorn-llc/21198,https://forum.makerdao.com/u/oasisproteam,2023-06-01,Maker Arranger Proposal: Matterhorn LLC
https://forum.makerdao.com/t/proposal-detect-80-of-your-malicious-hacks/21130,https://forum.makerdao.com/u/carmen,2023-06-01,[Proposal] Detect 80+% of your malicious hacks
