Link,Author,Release Date,Title
https://forum.scrt.network/t/about-the-private-computation-category/15,https://forum.scrt.network/u/tor,2018-06-01,About the Private Computation category
https://forum.scrt.network/t/beyond-sgx-1-cryptographic-improvements-to-the-networks-key-management-and-mev/6477,https://forum.scrt.network/u/guy,2024-02-21,Beyond SGX #1 - Cryptographic improvements to the networks key management and MEV
https://forum.scrt.network/t/differential-privacy-example/6214,https://forum.scrt.network/u/darwinzer0,2022-08-01,Differential privacy example
https://forum.scrt.network/t/epoch-reveal-privacy-obfuscation-technique/4570,https://forum.scrt.network/u/carter-woetzel,2021-10-01,Epoch Reveal Privacy Obfuscation Technique
https://forum.scrt.network/t/amd-tee-support/2524,https://forum.scrt.network/u/maxkoda,2021-01-01,AMD-TEE Support?
https://forum.scrt.network/t/private-machine-learning/1250,https://forum.scrt.network/u/ainsley,2020-08-01,Private Machine Learning
https://forum.scrt.network/t/the-world-s-billionaires-problem-verifiable-mpc-on-the-blockchain/1473,https://forum.scrt.network/u/guy,2020-03-01,‘The World’s Billionaires Problem’ - Verifiable MPC on the Blockchain
https://forum.scrt.network/t/garbled-circuits-primer-by-vitalik/1472,https://forum.scrt.network/u/guy,2020-03-01,Garbled circuits primer by Vitalik
https://forum.scrt.network/t/is-agreeing-on-the-order-of-processes-processors-a-challenge-in-multi-party-computing/1265,https://forum.scrt.network/u/econymous,2020-01-01,Is agreeing on the order of processes/processors a challenge in multi-party computing?
https://forum.scrt.network/t/the-implementation-of-mpc-in-enigma/1219,https://forum.scrt.network/u/stan_yi,2020-01-01,The implementation of mpc in enigma
https://forum.scrt.network/t/question-to-mpc-and-how-we-can-catch-up/1200,https://forum.scrt.network/u/eve,2019-12-01,Question to MPC and how we can catch up?
https://forum.scrt.network/t/computations-over-data/1175,https://forum.scrt.network/u/cryptojoe,2019-12-01,Computations over data
https://forum.scrt.network/t/machine-learning-library-works-on-secret-contract/1134,https://forum.scrt.network/u/kanagold,2019-11-01,Machine Learning Library works on Secret Contract
https://forum.scrt.network/t/is-ml-model-training-actually-possible-on-enigma-how/1125,https://forum.scrt.network/u/ezio,2019-10-01,Is ML model training actually possible on Enigma?How?
https://forum.scrt.network/t/current-state-of-intel-sgx-remote-attestation/1053,https://forum.scrt.network/u/dqs,2019-08-01,Current state of Intel SGX remote attestation
https://forum.scrt.network/t/private-transaction-from-gnosis-multisig-wallet/1047,https://forum.scrt.network/u/andreiiv,2019-08-01,Private transaction from Gnosis multisig wallet
https://forum.scrt.network/t/how-do-mpcs-handle-control-structures/996,https://forum.scrt.network/u/ericdoz,2019-07-01,How do MPC’s handle control structures?
https://forum.scrt.network/t/mpc-slowness-and-enigma-going-forward/936,https://forum.scrt.network/u/tom_j,2019-07-01,MPC Slowness and Enigma Going Forward
https://forum.scrt.network/t/cryptography-using-enigma-mpc/942,https://forum.scrt.network/u/stefan,2019-07-01,Cryptography using Enigma/MPC
https://forum.scrt.network/t/does-a-multi-chain-true-scaling-solution-have-implications-for-privacy-contracts/859,https://forum.scrt.network/u/econymous,2019-06-01,Does a multi-chain “true” scaling solution have implications for privacy contracts?
https://forum.scrt.network/t/zexe-zero-knowledge-execution-and-zether/724,https://forum.scrt.network/u/zed,2019-04-01,Zexe (Zero Knowledge Execution) and Zether
https://forum.scrt.network/t/intel-foreshadow-flaw/310,https://forum.scrt.network/u/un560,2019-03-01,Intel foreshadow flaw
https://forum.scrt.network/t/all-intel-chips-open-to-new-spoiler-non-spectre-attack-dont-expect-a-quick-fix/632,https://forum.scrt.network/u/zed,2019-03-01,All Intel chips open to new Spoiler non-Spectre attack: Don’t expect a quick fix
https://forum.scrt.network/t/securing-mpc-sgx-against-reversible-computations/590,https://forum.scrt.network/u/sbsends,2019-02-01,Securing MPC/SGX Against Reversible Computations
https://forum.scrt.network/t/work-on-homomorphic-encryption/587,https://forum.scrt.network/u/nigel,2019-02-01,Work on homomorphic encryption
https://forum.scrt.network/t/secret-against-n-1-corruptions-or-n-2/309,https://forum.scrt.network/u/exapted,2019-01-01,"Secret against n-1 corruptions, or n/2?"
https://forum.scrt.network/t/how-to-decrypt-encrypted-information-in-intel-sgx/557,https://forum.scrt.network/u/kim,2019-01-01,How to decrypt encrypted information in Intel SGX
https://forum.scrt.network/t/is-it-technically-possible-to-integrate-smpc-and-zero-knowledge-proof-together-general/548,https://forum.scrt.network/u/eve,2019-01-01,Is it technically possible to integrate SMPC and Zero Knowledge Proof together? (General)
https://forum.scrt.network/t/what-are-the-differences-republic-protocol-renvm-a-virtual-machine-for-privacy-preserving-computations-enigma/497,https://forum.scrt.network/u/eve,2018-12-01,What are the differences? Republic Protocol RenVM: A Virtual Machine for Privacy Preserving Computations / Enigma
https://forum.scrt.network/t/constant-round-mpc-and-its-applicability-to-secret-contracts/321,https://forum.scrt.network/u/guy,2018-08-01,Constant round MPC and its applicability to secret contracts
